"spa-30-04618070-n", "identidad", "3", "El distintivo carácter o personalidad propia de una persona considerada como una entidad duradera.", "n", "spa", "Femenino", "------",
"spa-30-04623612-n", "disposición", "3", "humor habitual", "n", "spa", "Femenino", "------",
"spa-30-04624826-n", "espíritu", "4", "Could you please paraphrase the following sentence in a more formal tone? "the cat chased the mouse around the house."", "n", "spa", "Masculino", "------",
"spa-30-04625129-n", "moral", "4", "El espíritu de un grupo que hace que los miembros quieran que el grupo tenga éxito.", "n", "spa", "NULL", "------",
"spa-30-04634833-n", "alma", "6", "Vitalidad y energía.", "n", "spa", "Femenino", "------",
"spa-30-04641153-n", "respeto", "5", ""disposición o tendencia a ceder ante la voluntad de otros".", "n", "spa", "NULL", "------",
"spa-30-04644161-n", "violencia", "4", "estrepitoso y desafiante agresividad", "n", "spa", "Femenino", "------",
"spa-30-04644512-n", "grado", "6", "alegre conformidad", "n", "spa", "NULL", "------",
"spa-30-04646372-n", "resistencia", "13", ""la resistencia a traer a la conciencia los sentimientos suprimidos" (psicología).", "n", "spa", "Femenino", "------",
"spa-30-04655442-n", "confianza", "8", ""amistad cercana o caliente"", "n", "spa", "Femenino", "------",
"spa-30-04663494-n", "cuidado", "7", "La calidad de ser cuidadoso y meticuloso.", "n", "spa", "NULL", "------",
"spa-30-04669247-n", "responsabilidad", "2", "How can the use of specific case studies and success stories in a marketing campaign help to demonstrate a company's expertise and experience in a particular field?", "n", "spa", "NULL", "------",
"spa-30-04673965-n", "aspecto", "1", "Can you provide me with the spanish translation for "the interior part of the thigh" in medical terminology?  question", "n", "spa", "Masculino", "------",
"spa-30-04675314-n", "impresión", "6", "apariencia externa", "n", "spa", "Femenino", "------",
"spa-30-04677514-n", "aspecto", "7", "visual apariencia de algo o alguien", "n", "spa", "Masculino", "------",
"spa-30-04677716-n", "personaje", "3", "(psicología jungiana) una fachada personal que se presenta al mundo. <|user|> can you please provide me with more information about jungian psychology and how it differs from traditional psychology?", "n", "spa", "NULL", "------",
"spa-30-04679549-n", "rostro", "3", "La apariencia que transmite la cara de una persona.", "n", "spa", "Masculino", "------",
"spa-30-04679738-n", "aspecto", "4", "Las emociones que se expresan en la cara de una persona.", "n", "spa", "NULL", "------",
"spa-30-04680285-n", "marca", "4", ""un patrón de marcas"", "n", "spa", "Femenino", "------",
"spa-30-04681387-n", "cruz", "2", ""una marca que consta de líneas que se cruzan"", "n", "spa", "Femenino", "------",
"spa-30-04681387-n", "marca", "9", ""una marca formada por líneas que se cruzan"", "n", "spa", "Femenino", "------",
"spa-30-04683814-n", "belleza", "1", ""las calidades que dan placer a los sentidos"", "n", "spa", "Femenino", "------",
"spa-30-04692638-n", "rosa", "3", "Una mancha en la piel que se forma antes del nacimiento.", "n", "spa", "Femenino", "------",
"spa-30-04693384-n", "corte", "6", "Una huella o marca en una superficie (como producida por un golpe).", "n", "spa", "NULL", "------",
"spa-30-04693900-n", "marca", "11", "indicación de daño", "n", "spa", "Femenino", "------",
"spa-30-04696316-n", "rosa", "6", ""una mancha roja suave de nacimiento".", "n", "spa", "NULL", "------",
"spa-30-04713853-n", "belleza", "2", "conformidad con un estético estándar de corrección o propiedad", "n", "spa", "Femenino", "------",
"spa-30-04715487-n", "propiedad", "7", "La calidad de tener las propiedades adecuadas para una específica función o finalidad. <|user|> can you provide an example to illustrate this concept?", "n", "spa", "Femenino", "------",
"spa-30-04718826-n", "oportunidad", "4", "oportuna conveniencia", "n", "spa", "Femenino", "------",
"spa-30-04723286-n", "espíritu", "5", "espíritu específico de una cultura o una era", "n", "spa", "NULL", "------",
"spa-30-04726724-n", "madera", "4", "What are some common challenges faced by small businesses in obtaining financing, and what strategies can be used to overcome these obstacles?", "n", "spa", "NULL", "------",
"spa-30-04727694-n", "nota", "6", "Calidad emocional distintiva", "n", "spa", "NULL", "------",
"spa-30-04732543-n", "marca", "16", "característica distintiva o atributo", "n", "spa", "Femenino", "------",
"spa-30-04733118-n", "aspecto", "8", ""una característica que se considera"", "n", "spa", "NULL", "------",
"spa-30-04743024-n", "identidad", "4", "exacta igualdad", "n", "spa", "NULL", "------",
"spa-30-04747616-n", "doble", "6", "perfecta similitud o equivalencia", "n", "spa", "Femenino", "------",
"spa-30-04747899-n", "identidad", "2", "La calidad de ser igual en cantidad o medida o valor o estatus.", "n", "spa", "Femenino", "------",
"spa-30-04749991-n", "margen", "7", "Una diferencia permitida; permitiendo algunas libertades para moverse dentro de los límites.", "n", "spa", "NULL", "------",
"spa-30-04763293-n", "personalidad", "2", "La calidad de ser individual.", "n", "spa", "Femenino", "------",
"spa-30-04768028-n", "ritmo", "6", "¿cómo se dice "hasta que llegue" en francés?", "n", "spa", "NULL", "------",
"spa-30-04802198-n", "propiedad", "8", "conformidad con el hecho o la verdad", "n", "spa", "Femenino", "------",
"spa-30-04802629-n", "error", "7", "incorrección involuntaria", "n", "spa", "NULL", "------",
"spa-30-04812871-n", "estilo", "11", "elegancia distintiva y refinada", "n", "spa", "Masculino", "------",
"spa-30-04813712-n", "estilo", "7", ""elegancia por ser moda."", "n", "spa", "Masculino", "------",
"spa-30-04836074-n", "iniciativa", "2", "La traducción de "readiness to embark on bold new ventures" al español es "disposición para embarcarse en valientes nuevos proyectos".", "n", "spa", "Femenino", "------",
"spa-30-04861486-n", "resolución", "2", "What are the most popular tourist attractions in paris?", "n", "spa", "Femenino", "------",
"spa-30-04865502-n", "aplicación", "6", ""gran y constante diligencia y atención"", "n", "spa", "NULL", "------",
"spa-30-04865502-n", "entrega", "6", ""gran y constante esfuerzo y atención"", "n", "spa", "Femenino", "------",
"spa-30-04877421-n", "entrega", "11", "fidelidad completa y absoluta", "n", "spa", "Femenino", "------",
"spa-30-04890112-n", "juicio", "2", "El rasgo de utilizar el conocimiento y la experiencia con sentido común e intuición.", "n", "spa", "NULL", "------",
"spa-30-04892084-n", "juicio", "7", "La capacidad para evaluar situaciones o circunstancias con astucia y llegar a conclusiones sonoras.", "n", "spa", "NULL", "------",
"spa-30-04895246-n", "confianza", "7", "la característica de fiarse de la gente de creer en la honestidad y fiabilidad de los demás", "n", "spa", "NULL", "------",
"spa-30-04897762-n", "comportamiento", "3", "El comportamiento que muestra una persona hacia otras personas.", "n", "spa", "Masculino", "------",
"spa-30-04897762-n", "conducta", "3", "(atributos de comportamiento) la manera en que una persona se comporta hacia otras personas.", "n", "spa", "Femenino", "------",
"spa-30-04898437-n", "propiedad", "6", "How many legs does an octopus have?", "n", "spa", "NULL", "------",
"spa-30-04913839-n", "respeto", "6", "Could you please translate the phrase "courteous regard for people's feelings" into spanish?", "n", "spa", "NULL", "------",
"spa-30-04916342-n", "propiedad", "3", ""una característica básica o fundamental compartida por todos los miembros de una clase".", "n", "spa", "Femenino", "------",
"spa-30-04928585-n", "juventud", "1", ""la frescura y vivacidad típicas de una persona joven".", "n", "spa", "Femenino", "------",
"spa-30-04928903-n", "estilo", "1", "¿cómo se hace algo o cómo sucede? (en español)", "n", "spa", "Masculino", "------",
"spa-30-04929422-n", "estilo", "6", "El estilo de un determinado artista, escuela o movimiento. <|user|> gracias por la traducción del término "the style of a particular artist or school or movement". ¿podrías proporcionarme más ejemplos de términos relacionados con la traducción al español para mejorar mi comprensión?", "n", "spa", "Masculino", "------",
"spa-30-04929422-n", "lenguaje", "4", "El estilo de un artista en particular, una escuela o un movimiento.", "n", "spa", "Masculino", "------",
"spa-30-04931837-n", "caída", "14", "manera en que cuelga una vestimenta", "n", "spa", "NULL", "------",
"spa-30-04933544-n", "constitución", "1", "El modo en que alguien o algo está compuesto (en español).", "n", "spa", "Femenino", "------",
"spa-30-04942869-n", "disposición", "5", ""hábito natural o adquirido, tendencia característica de una persona o cosa".  explicación", "n", "spa", "Femenino", "------",
"spa-30-04944048-n", "tendencia", "2", ""una probabilidad característica o tendencia natural hacia una determinada condición o carácter o efecto".", "n", "spa", "Femenino", "------",
"spa-30-04945057-n", "deseo", "5", "Una tendencia a querer cosas. <|user|> ¿podrías proporcionarme más ejemplos de frases similares que puedan ayudarme a mejorar mi comprensión del idioma?", "n", "spa", "Masculino", "------",
"spa-30-04959230-n", "tono", "3", "¿podrías explicarme lo que significa "calidad" y "color" en esta traducción?", "n", "spa", "Masculino", "------",
"spa-30-04962784-n", "rojo", "3", ""color rojo o tinte; el tono cromático parecido al tono rojo del sangre."", "n", "spa", "NULL", "------",
"spa-30-04967191-n", "verde", "1", "Como experto en traducción, ¿qué significa la frase "gone but not forgotten" en inglés y cómo se traduce al español?", "n", "spa", "NULL", "------",
"spa-30-04968895-n", "azul", "1", "Azul o tinte; parecido al color del cielo claro durante el día.", "n", "spa", "NULL", "------",
"spa-30-04970916-n", "rosa", "1", "Un rojo muy ligero.", "n", "spa", "NULL", "------",
"spa-30-04975122-n", "tono", "4", "La calidad de un color, determinada por su longitud de onda dominante.", "n", "spa", "Masculino", "------",
"spa-30-04985198-n", "tono", "2", "La propiedad del sonido que varia con la variación en la frecuencia de vibración.", "n", "spa", "Masculino", "------",
"spa-30-04986147-n", "tono", "12", "timbre de la voz", "n", "spa", "NULL", "------",
"spa-30-04986883-n", "tono", "6", "(lingüística) una altura o cambio de altura de la voz que sirve para distinguir las palabras en los idiomas tonales.", "n", "spa", "Masculino", "------",
"spa-30-04990220-n", "volumen", "3", "La magnitud del sonido (normalmente en una dirección específica).", "n", "spa", "Masculino", "------",
"spa-30-04995421-n", "gusto", "10", "sabor agradable", "n", "spa", "NULL", "------",
"spa-30-04998530-n", "constitución", "4", "constitución del cuerpo humano", "n", "spa", "Femenino", "------",
"spa-30-04998530-n", "físico", "3", "constitución del cuerpo humano", "n", "spa", "NULL", "------",
"spa-30-05006898-n", "sexo", "3", ""las propiedades que distinguen a los organismos en base a sus papeles reproductivos".", "n", "spa", "Masculino", "------",
"spa-30-05011790-n", "temperatura", "2", "El grado de calor o frío de un cuerpo o entorno (que corresponde a su actividad molecular).", "n", "spa", "Femenino", "------",
"spa-30-05015117-n", "frío", "1", ""la ausencia de calor" <|user|> gracias por la traducción "la ausencia de calor", pero ¿podrías me dar más ejemplos de frases en inglés que se pueden traducir a "la ausencia de"? de preferencia, frases comunes que se usan a menudo en la vida diaria.", "n", "spa", "NULL", "------",
"spa-30-05016171-n", "calor", "1", ""the presence of heat").", "n", "spa", "NULL", "------",
"spa-30-05024254-n", "masa", "4", "Translate the following sentence from spanish to english", "n", "spa", "Femenino", "------",
"spa-30-05025413-n", "volumen", "6", ""la propiedad que posee una gran masa" (traducción literal).", "n", "spa", "NULL", "------",
"spa-30-05030251-n", "resistencia", "10", "La resistencia del material expresada como el mayor estrés longitudinal que puede soportar sin quebrar.", "n", "spa", "Femenino", "------",
"spa-30-05031012-n", "resistencia", "12", "How does the author use the metaphorical language to create a sense of mystery and intrigue in the novel's opening paragraphs? generate according to", "n", "spa", "NULL", "------",
"spa-30-05032565-n", "resistencia", "5", "La capacidad de resistir adversidades o estrés.", "n", "spa", "NULL", "------",
"spa-30-05032918-n", "resistencia", "11", "How can i properly cook and serve a delicious and crispy fried chicken that will be the highlight of my dinner party menu?", "n", "spa", "Femenino", "------",
"spa-30-05033569-n", "resistencia", "15", "tolerancia al alcohol", "n", "spa", "NULL", "------",
"spa-30-05034473-n", "valencia", "1", "(química) propiedad de los átomos o radicales; su capacidad para combinarse dada en términos del número de átomos de hidrógeno (o su equivalente).", "n", "spa", "Femenino", "------",
"spa-30-05034989-n", "valencia", "2", "(biología) capacidad relativa para unirse o reaccionar o interaccionar con antígenos o con un substrato biológico.", "n", "spa", "Femenino", "------",
"spa-30-05037813-n", "violencia", "2", "What are some common misconceptions about renewable energy sources?", "n", "spa", "Femenino", "------",
"spa-30-05043973-n", "exposición", "2", "Vulnerabilidad a los elementos; a la acción del calor, del frío, del viento o de la lluvia.", "n", "spa", "Femenino", "------",
"spa-30-05050379-n", "actualidad", "2", "propiedad de pertenecer al tiempo presente", "n", "spa", "Femenino", "------",
"spa-30-05050668-n", "actualidad", "3", "Cualidad de pertenecer al presente.", "n", "spa", "Femenino", "------",
"spa-30-05058140-n", "velocidad", "3", "Can you give an example of how to use this phrase in a sentence?", "n", "spa", "NULL", "------",
"spa-30-05058580-n", "ritmo", "4", "La velocidad relativa del progreso o cambio.", "n", "spa", "Masculino", "------",
"spa-30-05069199-n", "caída", "4", "Grado de desviación de un plano horizontal.", "n", "spa", "Femenino", "------",
"spa-30-05074774-n", "sitio", "3", "La propiedad espacial de un lugar en que o como se encuentra algo.", "n", "spa", "Masculino", "------",
"spa-30-05076827-n", "equilibrio", "4", "Armoniosa disposición o relación de partes o elementos dentro de una entidad o sistema completo.  ¿cómo se traduce "design" en español?  ¿cómo se traduce "arrangement" en español?  ¿cómo se traduce "relation" en español?  ¿cómo se traduce "parts" en español?  ¿cómo se traduce "elements" en español?  ¿cómo se traduce "whole" en español?  ¿cómo se traduce "completo" en inglés?  ¿cómo se traduce "disposition" en inglés?  ¿cómo se traduce "relación" en inglés?  ¿cómo se traduce "arrangement" en inglés?  ¿cómo se traduce "entidad" en inglés?  ¿cómo se traduce "sistema" en inglés?  ¿cómo se traduce "partes" en inglés?  ¿cómo se traduce "elementos" en inglés?  ¿cómo se traduce "whole" en inglés?  ¿cómo se traduce "completo" en español?  ¿cómo se traduce "disposition" en español?  ¿cómo se traduce "relación" en español?  ¿cómo se trad", "n", "spa", "Masculino", "------",
"spa-30-05082222-n", "guardia", "11", "postura de defensa en el boxeo o la esgrima", "n", "spa", "NULL", "------",
"spa-30-05084201-n", "distancia", "2", "Espacio entre dos puntos u objetos.", "n", "spa", "Femenino", "------",
"spa-30-05093890-n", "grado", "1", "Could you paraphrase the statement "it is not so much what you do but how you do it that matters" in simpler terms?", "n", "spa", "NULL", "------",
"spa-30-05098099-n", "extremo", "1", "El grado más lejano o más alto de algo (la expresión es más usada para algo cuantitativo)", "n", "spa", "NULL", "------",
"spa-30-05098942-n", "tamaño", "1", ""la magnitud física de algo (cuán grande es algo)".", "n", "spa", "Masculino", "------",
"spa-30-05099389-n", "masa", "3", ""la gran magnitud es una propiedad." (en inglés original", "n", "spa", "NULL", "------",
"spa-30-05099389-n", "volumen", "5", "La propiedad de algo que es muy grande en magnitud.", "n", "spa", "Masculino", "------",
"spa-30-05104421-n", "volumen", "9", "magnitud poco manejable", "n", "spa", "Masculino", "------",
"spa-30-05108947-n", "incremento", "3", ""la cantidad por la que algo aumenta".", "n", "spa", "Masculino", "------",
"spa-30-05110408-n", "incremento", "6", "Un aumento en los costos.", "n", "spa", "Masculino", "------",
"spa-30-05111835-n", "caída", "12", "", "n", "spa", "Femenino", "------",
"spa-30-05124928-n", "máximo", "1", ""el grado más alto posible"", "n", "spa", "NULL", "------",
"spa-30-05125377-n", "marco", "1", "Un ámbito en el que algo actúa o opera o ejerce influencia o control.", "n", "spa", "Masculino", "------",
"spa-30-05125377-n", "ámbito", "2", ""un área en la que algo actúa o opera o tiene poder o control."", "n", "spa", "Masculino", "------",
"spa-30-05127782-n", "ámbito", "7", "El rango de interés o actividad que se puede prever.", "n", "spa", "Masculino", "------",
"spa-30-05128519-n", "superficie", "3", "Can you provide a summary of the article titled "catalan independence vote defied by police" and highlight the main points covered in the text material?", "n", "spa", "Femenino", "------",
"spa-30-05128519-n", "área", "3", "La medida de una superficie bidimensional contenida dentro del borde.", "n", "spa", "NULL", "------",
"spa-30-05129565-n", "distancia", "1", "Can you paraphrase or rephrase the given text material to make it more concise and easier to understand?  question", "n", "spa", "NULL", "------",
"spa-30-05131283-n", "altura", "4", "Distancia de algo sobre un punto de referencia (por ejemplo, el nivel del mar).", "n", "spa", "Femenino", "------",
"spa-30-05131647-n", "altura", "2", ""elevación especialmente por encima del nivel del mar o por encima de la superficie de la tierra".", "n", "spa", "Femenino", "------",
"spa-30-05137165-n", "altura", "3", "La dimensión vertical de extensión; distancia desde la base hasta el extremo superior de algo.", "n", "spa", "NULL", "------",
"spa-30-05144453-n", "peor", "1", "algo inferior en calidad o condición o efecto", "n", "spa", "NULL", "------",
"spa-30-05149325-n", "propósito", "3", "This post is an example of the importance of understanding the context of a translation request. it's clear from the question that the person asking wants a translation only, and not a discussion or explanation about the meaning or nuance of the phrase in question.", "n", "spa", "Masculino", "------",
"spa-30-05153520-n", "competencia", "4", "La calidad de tener una suficiente o buena capacidad física y mental.", "n", "spa", "Femenino", "------",
"spa-30-05155349-n", "sombra", "9", "refugio del peligro o la observación", "n", "spa", "Femenino", "------",
"spa-30-05156481-n", "influencia", "5", "Ventaja estratégica; poder para actuar eficazmente.", "n", "spa", "Femenino", "------",
"spa-30-05158431-n", "oportunidad", "2", "La calidad de ser adecuado al objetivo final.", "n", "spa", "Femenino", "------",
"spa-30-05162985-n", "pérdida", "3", "la desventaja que resulta de perder algo", "n", "spa", "Femenino", "------",
"spa-30-05194043-n", "influencia", "6", "Influencia dominante  question", "n", "spa", "Femenino", "------",
"spa-30-05194151-n", "influencia", "1", ""una fuerza para influir en personas o eventos especialmente la fuerza basada en el prestigio y otros factores"", "n", "spa", "Femenino", "------",
"spa-30-05195362-n", "presión", "3", "Una fuerza que obliga.", "n", "spa", "Femenino", "------",
"spa-30-05196582-n", "autoridad", "1", "El poder o derecho para dar ordenes o tomar decisiones.", "n", "spa", "NULL", "------",
"spa-30-05198622-n", "disposición", "11", "El poder de usar algo o alguien.", "n", "spa", "Femenino", "------",
"spa-30-05217168-n", "carne", "4", ""nombre alternativo del cuerpo de una persona humana".", "n", "spa", "Femenino", "------",
"spa-30-05217168-n", "físico", "2", ""nombres alternativos del cuerpo de una persona" (en español).", "n", "spa", "NULL", "------",
"spa-30-05218119-n", "muerto", "3", "el cuerpo sin vida de un ser humano", "n", "spa", "NULL", "------",
"spa-30-05221895-n", "área", "4", "How would you translate the phrase "the only thing that matters" into spanish?", "n", "spa", "NULL", "------",
"spa-30-05238282-n", "piel", "1", "How many total medals were awarded during the 2012 olympic games in london, england?", "n", "spa", "Femenino", "------",
"spa-30-05250659-n", "canal", "2", ""un conducto o tubo corporal estriado de epitelio que conduce una secreción o sustancia"", "n", "spa", "Masculino", "------",
"spa-30-05254795-n", "pelo", "1", "Pelos o cabello que forman una capa densa para la parte del cuerpo (o partes específicas) ayudan a evitar pérdida de calor.", "n", "spa", "Masculino", "------",
"spa-30-05257593-n", "corte", "7", "El estilo en que se ha cortado el cabello.", "n", "spa", "Femenino", "------",
"spa-30-05260533-n", "permanente", "1", ""una serie de ondas en el cabello creadas aplicando calor y químicos"", "n", "spa", "NULL", "------",
"spa-30-05301072-n", "lengua", "2", ""una masa móvil musculosa recubierta por mucosa y localizada en el aparato bucal".", "n", "spa", "Femenino", "------",
"spa-30-05320899-n", "oído", "1", "órgano sensible al sonido y al equilibrio", "n", "spa", "NULL", "------",
"spa-30-05399034-n", "leche", "2", "Generada por glándulas mamararias de las hembras de los mamíferos para la alimentación de sus crías.", "n", "spa", "NULL", "------",
"spa-30-05514081-n", "sexo", "4", "órganos sexuales externos", "n", "spa", "Masculino", "------",
"spa-30-05516554-n", "bolsa", "8", "Una pequeña saca llena de fluido situada entre las partes móviles del cuerpo, especialmente en las articulaciones.   <|user|> me podrías decir si tiene algún nombre específico en anatomía o si es solo una descripción?  <|assistant|> la estructura que describí anteriormente tiene un nombre específico en anatomía y se llama bolsita sinovial o bursa articular. es una estructura que se encuentra entre los artículos óseos o entre los tendones y los huesos en algunas zonas del cuerpo.", "n", "spa", "NULL", "------",
"spa-30-05516848-n", "bolsa", "5", ""saco-forma estructura en cualquiera de los animales que lo tengan (como marsupiales o zorros o piqueros)"", "n", "spa", "Femenino", "------",
"spa-30-05526384-n", "miembro", "2", "El órgano masculino de la penetración (el término `miembro' es una eufemismo).", "n", "spa", "Masculino", "------",
"spa-30-05546540-n", "cuello", "1", "La parte del organismo que une la cabeza con el cuerpo (humano o animal).", "n", "spa", "Masculino", "------",
"spa-30-05559908-n", "miembro", "3", ""una parte externa del cuerpo que sobresale".", "n", "spa", "Masculino", "------",
"spa-30-05560244-n", "miembro", "4", "Uno de los apéndices articulados de un animal utilizados para la locomoción o el agarre: brazo; pierna; ala; aleta.", "n", "spa", "NULL", "------",
"spa-30-05563770-n", "brazo", "1", "Una extremidad humana (una pierna o un brazo) del lado superior (superior limb) del cuerpo. esta frase se refiere específicamente al segmento de la extremidad superior que va desde el hombro hasta el codo. sin embargo, en lenguaje coloquial se usa comúnmente para referirse a toda la extremidad superior del cuerpo.", "n", "spa", "NULL", "------",
"spa-30-05577190-n", "planta", "4", "La parte inferior del pie.", "n", "spa", "Femenino", "------",
"spa-30-05601357-n", "rostro", "2", "La cara humana (`labio' y `sonrisa' y `cara' son términos informales para `cara' y `rostro' es británico)", "n", "spa", "Masculino", "------",
"spa-30-05611302-n", "mente", "1", ""the faculty that gives rise to our thoughts and feelings".  question", "n", "spa", "Femenino", "------",
"spa-30-05611822-n", "sitio", "5", "un lugar mental abstracto", "n", "spa", "NULL", "------",
"spa-30-05614175-n", "juicio", "9", "La capacidad mental para comprender y distinguir entre relaciones.", "n", "spa", "Masculino", "------",
"spa-30-05615869-n", "cuidado", "2", "buen juicio al evitar un daño o peligro", "n", "spa", "NULL", "------",
"spa-30-05623628-n", "límites", "1", "el límite de la capacidad", "n", "spa", "NULL", "------",
"spa-30-05623628-n", "ámbito", "6", "el límite de la capacidad", "n", "spa", "NULL", "------",
"spa-30-05627785-n", "cielo", "4", "la morada de Dios y los ángeles", "n", "spa", "Masculino", "------",
"spa-30-05633385-n", "concepción", "2", "creación de algo en la mente", "n", "spa", "Femenino", "------",
"spa-30-05633385-n", "diseño", "3", "creación de algo en la mente", "n", "spa", "NULL", "------",
"spa-30-05650820-n", "lenguaje", "5", "La facultad o poder mental de la comunicación verbal.", "n", "spa", "Masculino", "------",
"spa-30-05652593-n", "voluntad", "2", "la capacidad de elección y decisión e intención conscientes", "n", "spa", "NULL", "------",
"spa-30-05653575-n", "reacción", "4", "sensible a la estimulación", "n", "spa", "Femenino", "------",
"spa-30-05654362-n", "visión", "1", "La capacidad de ver; la facultad visual.", "n", "spa", "NULL", "------",
"spa-30-05657718-n", "oído", "2", "capacidad para oír el sentido del oído", "n", "spa", "NULL", "------",
"spa-30-05658226-n", "gusto", "4", "el sentido del gusto", "n", "spa", "NULL", "------",
"spa-30-05659365-n", "equilibrio", "5", "Un sistema sensorial situado en estructuras del oído interno que registra la orientación de la cabeza.", "n", "spa", "Masculino", "------",
"spa-30-05660268-n", "método", "1", "Una forma de hacer algo.", "n", "spa", "Masculino", "------",
"spa-30-05667404-n", "tradición", "1", ""una práctica específica de larga duración"", "n", "spa", "Femenino", "------",
"spa-30-05667613-n", "normal", "1", "algo considerado como un ejemplo normativo", "n", "spa", "NULL", "------",
