"spa-30-04681387-n", "cruz", "2", "Can you provide a summary of the main themes and motifs in edgar allan poe's poem "the raven"?", "n", "spa", "Femenino", "------",
"spa-30-04681387-n", "marca", "9", ""una marca que consiste en líneas que se cruzan"", "n", "spa", "Femenino", "------",
"spa-30-04683814-n", "belleza", "1", "Las cualidades que dan placer a los sentidos (las cinco sentidos son la vista, el oído, el olfato, el gusto y el tacto).", "n", "spa", "Femenino", "------",
"spa-30-04692638-n", "rosa", "3", "Una mancha en la piel que se forma antes del nacimiento.", "n", "spa", "NULL", "------",
"spa-30-04693384-n", "corte", "6", ""una impresión en una superficie (causada por un golpe)"", "n", "spa", "Masculino", "------",
"spa-30-04693900-n", "marca", "11", "indicación de daño", "n", "spa", "Femenino", "------",
"spa-30-04696316-n", "rosa", "6", ""una marcapasos rojo suave de nacimiento"", "n", "spa", "NULL", "------",
"spa-30-04713853-n", "belleza", "2", "conformidad con un estético estándar de corrección o propiedad", "n", "spa", "Femenino", "------",
"spa-30-04715487-n", "propiedad", "7", "La calidad de tener las propiedades que son apropiadas para un propósito específico.", "n", "spa", "Femenino", "------",
"spa-30-04718826-n", "oportunidad", "4", "oportuna conveniencia", "n", "spa", "Femenino", "------",
"spa-30-04723286-n", "espíritu", "5", "espíritu específico de una cultura o una era", "n", "spa", "Masculino", "------",
"spa-30-04726724-n", "madera", "4", "Las características o calidades esenciales por las que se reconoce algo.", "n", "spa", "Femenino", "------",
"spa-30-04727694-n", "nota", "6", ""una calidad emocional característica" (literal) o simplemente "calidad emocional característica" (más común).", "n", "spa", "Femenino", "------",
"spa-30-04732543-n", "marca", "16", "característica distintiva o atributo", "n", "spa", "Femenino", "------",
"spa-30-04733118-n", "aspecto", "8", "Una característica a ser considerada. how do you translate the phrase "a characteristic to be considered" from english to spanish?", "n", "spa", "Masculino", "------",
"spa-30-04743024-n", "identidad", "4", "exacta igualdad", "n", "spa", "Femenino", "------",
"spa-30-04747616-n", "doble", "6", "perfecta similitud o equivalencia", "n", "spa", "Femenino", "------",
"spa-30-04747899-n", "identidad", "2", ""la calidad de ser igual en cantidad, medida, valor o estatus"", "n", "spa", "Femenino", "------",
"spa-30-04749991-n", "margen", "7", ""una diferencia permitida; permitiendo alguna libertad para moverse dentro de las limitaciones".", "n", "spa", "NULL", "------",
"spa-30-04763293-n", "personalidad", "2", ""la calidad de ser único" or "la individualidad".", "n", "spa", "NULL", "------",
"spa-30-04768028-n", "ritmo", "6", ""ocurriendo de manera recurrente en intervalos regulares"", "n", "spa", "Masculino", "------",
"spa-30-04802198-n", "propiedad", "8", "conformidad con el hecho o la verdad", "n", "spa", "NULL", "------",
"spa-30-04802629-n", "error", "7", "incorrección involuntaria", "n", "spa", "NULL", "------",
"spa-30-04812871-n", "estilo", "11", "elegancia distintiva y refinada", "n", "spa", "NULL", "------",
"spa-30-04813712-n", "estilo", "7", ""elegancia por ser moda".", "n", "spa", "Masculino", "------",
"spa-30-04836074-n", "iniciativa", "2", ""disposición para emprender audaces nuevas empresas".", "n", "spa", "Femenino", "------",
"spa-30-04861486-n", "resolución", "2", "How would you translate the phrase "the trait of being resolute" into spanish?", "n", "spa", "NULL", "------",
"spa-30-04865502-n", "aplicación", "6", "Gran y constante diligencia y atención.", "n", "spa", "Femenino", "------",
"spa-30-04865502-n", "entrega", "6", "What are the primary goals of the department of energy's advanced research projects agency-energy (arpa-e), and how have its investments in high-risk, high-reward projects impacted the field of energy research?  generate according to", "n", "spa", "NULL", "------",
"spa-30-04877421-n", "entrega", "11", "fidelidad completa y absoluta", "n", "spa", "Femenino", "------",
"spa-30-04890112-n", "juicio", "2", "La calidad de utilizar conocimientos y experiencia con sensatez y agudez de pensamiento.", "n", "spa", "Masculino", "------",
"spa-30-04892084-n", "juicio", "7", "How can i make a delicious chicken fajitas recipe at home?", "n", "spa", "NULL", "------",
"spa-30-04895246-n", "confianza", "7", "la característica de fiarse de la gente de creer en la honestidad y fiabilidad de los demás", "n", "spa", "NULL", "------",
"spa-30-04897762-n", "comportamiento", "3", "(características comportamentales) el modo en que una persona se comporta hacia otras personas.", "n", "spa", "Masculino", "------",
"spa-30-04897762-n", "conducta", "3", "El comportamiento de una persona hacia otras personas (atributos behaviorales).", "n", "spa", "Femenino", "------",
"spa-30-04898437-n", "propiedad", "6", "Conducta correcta o apropiada.", "n", "spa", "Femenino", "------",
"spa-30-04913839-n", "respeto", "6", ""please translate the following phrase from english to spanish", "n", "spa", "NULL", "------",
"spa-30-04916342-n", "propiedad", "3", "Una característica básica o fundamental que todos los miembros de una clase comparten.", "n", "spa", "Femenino", "------",
"spa-30-04928585-n", "juventud", "1", "La frescura y la vivacidad propicias de una persona joven.", "n", "spa", "Femenino", "------",
"spa-30-04928903-n", "estilo", "1", ""cómo se hace algo o cómo sucede".", "n", "spa", "Masculino", "------",
"spa-30-04929422-n", "estilo", "6", "Por favor, me gustaría ver algunas obras representativas del estilo de una escuela o movimiento concreto que me mencionaste antes. ¿podrías hacerlo?", "n", "spa", "Masculino", "------",
"spa-30-04929422-n", "lenguaje", "4", "El estilo de un artista específico o una escuela o un movimiento.", "n", "spa", "NULL", "------",
"spa-30-04931837-n", "caída", "14", "manera en que cuelga una vestimenta", "n", "spa", "Femenino", "------",
"spa-30-04933544-n", "constitución", "1", "La forma o manera en que alguien o algo está compuesto.", "n", "spa", "Femenino", "------",
"spa-30-04942869-n", "disposición", "5", ""una hábito o tendencia nacida o adquirida por naturaleza o por circunstancias en una persona o cosa."", "n", "spa", "Femenino", "------",
"spa-30-04944048-n", "tendencia", "2", ""probabilidad característica o inclinación natural hacia una determinada condición o carácter o efecto."", "n", "spa", "Femenino", "------",
"spa-30-04945057-n", "deseo", "5", ""una tendencia a querer cosas"", "n", "spa", "NULL", "------",
"spa-30-04959230-n", "tono", "3", "Calidad ligeramente diferente de un color en comparación con otro color.", "n", "spa", "Masculino", "------",
"spa-30-04962784-n", "rojo", "3", "El color rojo o pigmento; el color cromático que se asemeja al tono de sangre.", "n", "spa", "NULL", "------",
"spa-30-04967191-n", "verde", "1", "Verde o pigmento verde; semejante al color del pasto verde creciendo.", "n", "spa", "NULL", "------",
"spa-30-04968895-n", "azul", "1", ""azul color o pigmento; parecido al tono del cielo claro durante el día".", "n", "spa", "NULL", "------",
"spa-30-04970916-n", "rosa", "1", "Un tono ligeramente rojo (el color).", "n", "spa", "NULL", "------",
"spa-30-04975122-n", "tono", "4", "La calidad del color como determinada por su longitud de onda dominante.", "n", "spa", "Masculino", "------",
"spa-30-04985198-n", "tono", "2", "La propiedad del sonido que varía con la variación en la frecuencia de las vibraciones", "n", "spa", "Masculino", "------",
"spa-30-04986147-n", "tono", "12", "timbre de la voz", "n", "spa", "NULL", "------",
"spa-30-04986883-n", "tono", "6", "" (lenguística) un tono o cambio de tono de la voz que sirve para distinguir las palabras en los idiomas tonales".", "n", "spa", "NULL", "------",
"spa-30-04990220-n", "volumen", "3", "In english, the term "magnitude" is often used to describe the size or extent of something, and specifically in this context it's referring to the loudness or intensity of sound. the phrase "in a specified direction" means that the loudness or intensity of the sound is being measured from a particular location or position. in spanish, the word "magnitud" can be translated as "magnitud" and the phrase "in a specified direction" is translated as "en una dirección especificada".", "n", "spa", "NULL", "------",
"spa-30-04995421-n", "gusto", "10", "sabor agradable", "n", "spa", "Masculino", "------",
"spa-30-04998530-n", "constitución", "4", "constitución del cuerpo humano", "n", "spa", "NULL", "------",
"spa-30-04998530-n", "físico", "3", "constitución del cuerpo humano", "n", "spa", "NULL", "------",
"spa-30-05006898-n", "sexo", "3", "Las propiedades que determinan a los organismos en base a sus papeles reproductivos.", "n", "spa", "NULL", "------",
"spa-30-05011790-n", "temperatura", "2", "El grado de calor o frío de un cuerpo o entorno (correspondiente a su actividad molécula).", "n", "spa", "Femenino", "------",
"spa-30-05015117-n", "frío", "1", " this is a simple translation using the spanish words for "absence" and "heat." the phrase in english is "the absence of heat." the phrase in spanish is "la ausencia de calor." note that spanish does not require an article (i.e., "el" or "la") before "ausencia" because it is already a noun and does not need to be modified by an article (unless it is preceded by a preposition).", "n", "spa", "Masculino", "------",
"spa-30-05016171-n", "calor", "1", "La presencia del calor", "n", "spa", "NULL", "------",
"spa-30-05024254-n", "masa", "4", "La propiedad de un cuerpo que lo hace tener peso en un campo gravitatorio.", "n", "spa", "Femenino", "------",
"spa-30-05025413-n", "volumen", "6", ""la propiedad que posee una masa grande."", "n", "spa", "NULL", "------",
"spa-30-05030251-n", "resistencia", "10", "La resistencia del material que se expresa como el mayor estrés longitudinal que puede soportar sin desgastarse.", "n", "spa", "NULL", "------",
"spa-30-05031012-n", "resistencia", "12", ""la propiedad de ser fuerte y saludable en constitución"", "n", "spa", "Femenino", "------",
"spa-30-05032565-n", "resistencia", "5", "La fuerza de soportar dificultades o estrés.", "n", "spa", "Femenino", "------",
"spa-30-05032918-n", "resistencia", "11", ""fuerte y duradero poder y energía"", "n", "spa", "Femenino", "------",
"spa-30-05033569-n", "resistencia", "15", "tolerancia al alcohol", "n", "spa", "NULL", "------",
"spa-30-05034473-n", "valencia", "1", ""propiedad de los átomos o radicales; su capacidad para combinar según se indica en términos del número de átomos de hidrógeno (o el equivalente)"", "n", "spa", "Femenino", "------",
"spa-30-05034989-n", "valencia", "2", "(biología) una capacidad relativa para unirse o reaccionar o interactuar, por ejemplo, con antígenos o una sustancia biológica.", "n", "spa", "NULL", "------",
"spa-30-05037813-n", "violencia", "2", "¿cómo se dice "the color of my eyes is green" en español?", "n", "spa", "Femenino", "------",
"spa-30-05043973-n", "exposición", "2", ""vulnerabilidad a los elementos; a la acción del calor o del frío o del viento o de la lluvia".", "n", "spa", "NULL", "------",
"spa-30-05050379-n", "actualidad", "2", "propiedad de pertenecer al tiempo presente", "n", "spa", "Femenino", "------",
"spa-30-05050668-n", "actualidad", "3", "Cualidad de pertenecer al presente.", "n", "spa", "Femenino", "------",
"spa-30-05058140-n", "velocidad", "3", ""a speed (usually fast) at which algo ocurre" or "una velocidad (generalmente rápida) a la que algo ocurre"", "n", "spa", "Femenino", "------",
"spa-30-05058580-n", "ritmo", "4", "Can you paraphrase the statement "it's all in the name" into spanish?", "n", "spa", "Masculino", "------",
"spa-30-05069199-n", "caída", "4", "How do you say "degree of deviation from a horizontal plane" in spanish?", "n", "spa", "Femenino", "------",
"spa-30-05074774-n", "sitio", "3", ""la propiedad espacial de un lugar, donde o cómo se sitúa algo".", "n", "spa", "Masculino", "------",
"spa-30-05076827-n", "equilibrio", "4", "Armonioso orden o relación entre las partes o elementos dentro de una unidad (como en un diseño)", "n", "spa", "Masculino", "------",
"spa-30-05082222-n", "guardia", "11", "postura de defensa en el boxeo o la esgrima", "n", "spa", "Femenino", "------",
"spa-30-05084201-n", "distancia", "2", "Espacio entre dos puntos u objetos.", "n", "spa", "NULL", "------",
"spa-30-05093890-n", "grado", "1", ""posición en una escala de intensidad, cantidad o calidad".", "n", "spa", "NULL", "------",
"spa-30-05098099-n", "extremo", "1", "Can you provide me with a list of traditional dishes from the basque region?", "n", "spa", "NULL", "------",
"spa-30-05098942-n", "tamaño", "1", ""el tamaño físico de algo"  another translation could be "la magnitud física de algo".   both translations are correct and can be used interchangeably in most contexts. however, "tamaño físico" is more commonly used in spanish than "magnitud física".", "n", "spa", "Masculino", "------",
"spa-30-05099389-n", "masa", "3", "La magnitud grande del algo (la propiedad)", "n", "spa", "Femenino", "------",
"spa-30-05099389-n", "volumen", "5", "The following is the first stanza from a poem titled “the dark night”. write a continuation for the second stanza.", "n", "spa", "NULL", "------",
"spa-30-05104421-n", "volumen", "9", "magnitud poco manejable", "n", "spa", "Masculino", "------",
"spa-30-05108947-n", "incremento", "3", "Can you translate the phrase "the amount by which something increases" into spanish?", "n", "spa", "Masculino", "------",
"spa-30-05110408-n", "incremento", "6", "Aumento en costos.", "n", "spa", "NULL", "------",
"spa-30-05111835-n", "caída", "12", ""una repentina y brusca disminución en una cantidad determinada".", "n", "spa", "Femenino", "------",
"spa-30-05124928-n", "máximo", "1", "Can you paraphrase the phrase "the greatest possible degree" in spanish?", "n", "spa", "Masculino", "------",
"spa-30-05125377-n", "marco", "1", ""un ámbito en el que algo actúa o opera o ejerce su poder o control".", "n", "spa", "Masculino", "------",
"spa-30-05125377-n", "ámbito", "2", ""un ámbito en el que algo actúa o opera o tiene poder o control"", "n", "spa", "NULL", "------",
"spa-30-05127782-n", "ámbito", "7", "El rango de interés o actividad que se puede esperar.", "n", "spa", "Masculino", "------",
"spa-30-05128519-n", "superficie", "3", ""el alcance de una superficie bidimensional contenida dentro de una frontera".", "n", "spa", "NULL", "------",
"spa-30-05128519-n", "área", "3", "El alcance o tamaño de una superficie bidimensional rodeada por un límite.", "n", "spa", "Femenino", "------",
"spa-30-05129565-n", "distancia", "1", "How can we ensure that all children have access to high-quality preschool education regardless of their socio-economic background?", "n", "spa", "NULL", "------",
"spa-30-05131283-n", "altura", "4", "Distancia de algo por encima de un punto de referencia (por ejemplo, el nivel del mar).", "n", "spa", "Femenino", "------",
"spa-30-05131647-n", "altura", "2", " elevation is a measure of height or altitude of a location or object with respect to a reference point, such as sea level or the surface of the earth. therefore, when we say "elevation especially above sea level or above the earth's surface," we are referring to the height of a location or object relative to sea level or the surface of the earth, which is what the spanish translation means as well.  in spanish, the term used for elevation is altitud, which is a translation of the english word elevation. the spanish phrase we are using to translate the english phrase is "altitud especialmente por encima del nivel del mar o por encima de la superficie de la tierra," which translates to "altitude, particularly above sea level or above the earth's surface." this spanish phrase accurately captures the same meaning as the original english phrase.", "n", "spa", "NULL", "------",
"spa-30-05137165-n", "altura", "3", "La dimensión vertical de extensión o distancia desde la base hasta la parte superior.", "n", "spa", "Femenino", "------",
"spa-30-05144453-n", "peor", "1", "algo inferior en calidad o condición o efecto", "n", "spa", "NULL", "------",
"spa-30-05149325-n", "propósito", "3", "What's a good alternative to mayonnaise for a salad dressing?", "n", "spa", "Masculino", "------",
"spa-30-05153520-n", "competencia", "4", "La calidad de ser suficientemente o satisfactoriamente capacitado físicamente y intelectualmente.", "n", "spa", "NULL", "------",
"spa-30-05155349-n", "sombra", "9", "refugio del peligro o la observación", "n", "spa", "Femenino", "------",
"spa-30-05156481-n", "influencia", "5", "Ventaja estratégica; poder para actuar efectivamente (en español).", "n", "spa", "Femenino", "------",
"spa-30-05158431-n", "oportunidad", "2", "La calidad de ser adecuado para lo que se quiere lograr", "n", "spa", "Femenino", "------",
"spa-30-05162985-n", "pérdida", "3", "la desventaja que resulta de perder algo", "n", "spa", "Femenino", "------",
"spa-30-05194043-n", "influencia", "6", ""influencia controladora".", "n", "spa", "Femenino", "------",
"spa-30-05194151-n", "influencia", "1", ""una capacidad para influir en personas o eventos, especialmente una capacidad basada en prestigio o autoridad"", "n", "spa", "Femenino", "------",
"spa-30-05195362-n", "presión", "3", "Translate the phrase "a force that compels" into spanish.", "n", "spa", "Femenino", "------",
"spa-30-05196582-n", "autoridad", "1", "El poder o derecho de emitir órdenes o tomadas decisiones.", "n", "spa", "NULL", "------",
"spa-30-05198622-n", "disposición", "11", "Can you provide me with a summary of the article about the upcoming release of the book "a world apart" by author david poyer and how it relates to the us naval academy's stem-v initiative?", "n", "spa", "NULL", "------",
"spa-30-05217168-n", "carne", "4", ""nombres alternativos para el cuerpo de una persona humana" (en inglés "human being" significa "ser humano" o "persona")", "n", "spa", "Femenino", "------",
"spa-30-05217168-n", "físico", "2", ""nombres alternativos del cuerpo de un ser humano".", "n", "spa", "NULL", "------",
"spa-30-05218119-n", "muerto", "3", "el cuerpo sin vida de un ser humano", "n", "spa", "NULL", "------",
"spa-30-05221895-n", "área", "4", "Una parte del cuerpo de un animal que cumple una función especial o que está suministrada por una artéria o nervio específico.", "n", "spa", "NULL", "------",
"spa-30-05238282-n", "piel", "1", " the phrase "natural protective body covering" is referring to the skin, which is a part of our bodies that protects us from external elements such as sun, wind, and water. the phrase "site of the sense of touch" refers to the receptors in our skin that allow us to feel touch. therefore, the translated phrase in spanish would be "una capa protectora natural y sitio del sentido del tacto".", "n", "spa", "Femenino", "------",
"spa-30-05250659-n", "canal", "2", "Un conducto corporal estriado o tubo revestido por células epiteliales que conduce un secreto o otra sustancia.", "n", "spa", "Masculino", "------",
"spa-30-05254795-n", "pelo", "1", ""un tapete hecho de pelos finos que cubren el cuerpo o partes de él, ayudando a prevenir pérdidas de calor".", "n", "spa", "NULL", "------",
"spa-30-05257593-n", "corte", "7", ""el estilo de cómo se ha cortado el cabello"", "n", "spa", "NULL", "------",
"spa-30-05260533-n", "permanente", "1", "Una serie de ondas en el cabello que se crean aplicando calor y productos químicos", "n", "spa", "NULL", "------",
"spa-30-05301072-n", "lengua", "2", "Please provide the spanish translation for the following phrase in english", "n", "spa", "Femenino", "------",
"spa-30-05320899-n", "oído", "1", "órgano sensible al sonido y al equilibrio", "n", "spa", "Masculino", "------",
"spa-30-05399034-n", "leche", "2", ""produce por glándulas mamarias femeninas para alimentar a sus crías".", "n", "spa", "Femenino", "------",
"spa-30-05514081-n", "sexo", "4", "órganos sexuales externos", "n", "spa", "NULL", "------",
"spa-30-05516554-n", "bolsa", "8", ""un pequeño saco líquido ubicado entre los segmentos móviles del cuerpo especialmente en las articulaciones."", "n", "spa", "Femenino", "------",
"spa-30-05516848-n", "bolsa", "5", "(anatomía) estructura sacoide en cualquier animal (como una marsopia, un topo o un pelícano).", "n", "spa", "Femenino", "------",
"spa-30-05526384-n", "miembro", "2", "El órgano masculino de la penetración (el término `miembro' es una eufemismo).", "n", "spa", "NULL", "------",
"spa-30-05546540-n", "cuello", "1", "La parte del cuerpo que une la cabeza con el resto del cuerpo.", "n", "spa", "NULL", "------",
"spa-30-05559908-n", "miembro", "3", "Based on the text material, what is the main idea or theme being conveyed?  generate according to", "n", "spa", "NULL", "------",
"spa-30-05560244-n", "miembro", "4", ""uno de los apéndices articulados de un animal utilizados para la movilidad o el agarre: brazo; pierna; ala; aleta".", "n", "spa", "Masculino", "------",
"spa-30-05563770-n", "brazo", "1", ""una extremidad humana; técnicamente el segmento del miembro superior entre el hombro y el codo, pero comúnmente utilizado para referirse a todo el miembro superior".", "n", "spa", "Masculino", "------",
"spa-30-05577190-n", "planta", "4", "La parte inferior del pie.", "n", "spa", "Femenino", "------",
"spa-30-05601357-n", "rostro", "2", ""el rostro humano (`labio' y `sonrisa' y `cara' son términos informales para 'rostro' y 'figura' es británico)."", "n", "spa", "Masculino", "------",
"spa-30-05611302-n", "mente", "1", "La traducción de la frase "that which is responsible for one's thoughts and feelings; the seat of the faculty of reason" al español es "lo que está responsable por sus pensamientos y emociones; el asiento de la facultad razonadora".", "n", "spa", "Femenino", "------",
"spa-30-05611822-n", "sitio", "5", "un lugar mental abstracto", "n", "spa", "Masculino", "------",
"spa-30-05614175-n", "juicio", "9", "La capacidad mental para comprender y diferenciar relaciones.", "n", "spa", "Masculino", "------",
"spa-30-05615869-n", "cuidado", "2", "buen juicio al evitar un daño o peligro", "n", "spa", "NULL", "------",
"spa-30-05623628-n", "límites", "1", "el límite de la capacidad", "n", "spa", "NULL", "------",
"spa-30-05623628-n", "ámbito", "6", "el límite de la capacidad", "n", "spa", "Masculino", "------",
"spa-30-05627785-n", "cielo", "4", "la morada de Dios y los ángeles", "n", "spa", "Masculino", "------",
"spa-30-05633385-n", "concepción", "2", "creación de algo en la mente", "n", "spa", "Femenino", "------",
"spa-30-05633385-n", "diseño", "3", "creación de algo en la mente", "n", "spa", "NULL", "------",
"spa-30-05650820-n", "lenguaje", "5", "La facultad mental o poder de comunicación vocálica.", "n", "spa", "Masculino", "------",
"spa-30-05652593-n", "voluntad", "2", "la capacidad de elección y decisión e intención conscientes", "n", "spa", "Femenino", "------",
"spa-30-05653575-n", "reacción", "4", "sensible a la estimulación", "n", "spa", "Femenino", "------",
"spa-30-05654362-n", "visión", "1", "La facultad visual, la capacidad de ver.", "n", "spa", "Femenino", "------",
"spa-30-05657718-n", "oído", "2", "capacidad para oír el sentido del oído", "n", "spa", "NULL", "------",
"spa-30-05658226-n", "gusto", "4", "el sentido del gusto", "n", "spa", "NULL", "------",
"spa-30-05659365-n", "equilibrio", "5", ""un sistema sensorial situado en estructuras del oído interno que registra la orientación de la cabeza."", "n", "spa", "Masculino", "------",
"spa-30-05660268-n", "método", "1", ""una manera de hacer algo."", "n", "spa", "Masculino", "------",
"spa-30-05667404-n", "tradición", "1", "Can you suggest a list of vegan restaurants in the area that specialize in mexican cuisine?", "n", "spa", "Femenino", "------",
"spa-30-05667613-n", "normal", "1", "algo considerado como un ejemplo normativo", "n", "spa", "NULL", "------",
"spa-30-05670710-n", "preocupación", "1", ""algo que te interesa porque es importante o afecta a ti"", "n", "spa", "Femenino", "------",
"spa-30-05677504-n", "sensación", "6", "What are some ways to cultivate and maintain a general conscious awareness in daily life?", "n", "spa", "Femenino", "------",
"spa-30-05692910-n", "influencia", "3", ""un factor cognitivo que tiende a tener un efecto en lo que haces".", "n", "spa", "Femenino", "------",
"spa-30-05693383-n", "marca", "18", "influencia distintiva", "n", "spa", "Femenino", "------",
"spa-30-05697363-n", "autoridad", "4", "libre de duda fé en tí mismo y tus habilidades", "n", "spa", "NULL", "------",
"spa-30-05697976-n", "confianza", "9", "Por favor, puedes me traducir el título del libro "science and human welfare" del filósofo john dewey?", "n", "spa", "NULL", "------",
"spa-30-05697976-n", "fe", "5", "How does the use of repetition in the poem "stopping by woods on a snowy evening" contribute to its overall mood and meaning?", "n", "spa", "NULL", "------",
"spa-30-05700087-n", "preocupación", "2", "El estado mental de estar distraído o obsesionado por algo.", "n", "spa", "Femenino", "------",
"spa-30-05707718-n", "sensación", "7", "comprensión intuitiva de algo", "n", "spa", "Femenino", "------",
"spa-30-05712076-n", "impresión", "2", "percepción elemental y simple de una estimulación", "n", "spa", "Femenino", "------",
"spa-30-05712076-n", "sensación", "1", "percepción elemental y simple de una estimulación", "n", "spa", "Femenino", "------",
"spa-30-05715283-n", "gusto", "2", "La sensación que surge cuando los receptores gustativos en la lengua y el garganta transmiten información sobre la composición química de una estímulo disuelto.", "n", "spa", "NULL", "------",
