"spa-30-00001740-n", "entidad", "1", "aquello que se percibe o se sabe o se infiere que tiene su existencia propia distinta (viva o no viva)", "n", "spa", "NULL", "------",
"spa-30-00004258-n", "organismo", "2", "una entidad viva", "n", "spa", "Masculino", "------",
"spa-30-00004475-n", "organismo", "1", "un ser vivo que tiene (o puede desarrollar) la capacidad de actuar o funcionar de manera independiente", "n", "spa", "Masculino", "------",
"spa-30-00007846-n", "alguno", "1", "un ser humano", "n", "spa", "NULL", "------",
"spa-30-00007846-n", "alma", "1", "un ser humano", "n", "spa", "Femenino", "------",
"spa-30-00007846-n", "individuo", "1", "un ser humano", "n", "spa", "Masculino", "------",
"spa-30-00015388-n", "animal", "1", "un organismo vivo dotado de movimiento voluntario", "n", "spa", "Masculino", "------",
"spa-30-00017222-n", "planta", "1", "(Botánica) un organismo vivo que carece del poder de la locomoción", "n", "spa", "Femenino", "------",
"spa-30-00021265-n", "comida", "7", "cualquier sustancia que puede ser metabolizado por un animal para dar energía y construir tejido", "n", "spa", "Femenino", "------",
"spa-30-00023773-n", "motivo", "1", "Could you also provide examples of situations where the concept of 'motive' is most commonly applied?", "n", "spa", "Masculino", "------",
"spa-30-00026192-n", "sensación", "2", "experimentación de estados emocionales y afectivos", "n", "spa", "Femenino", "------",
"spa-30-00034213-n", "fenómeno", "1", ""cualquier estado o proceso que se conoce a través del sentido, en lugar de la intuición o la razón"", "n", "spa", "Masculino", "------",
"spa-30-00035189-n", "realización", "2", "What is the best way to clean a cast iron skillet without using soap?", "n", "spa", "Femenino", "------",
"spa-30-00037200-n", "crédito", "9", "usado en la expresión en su haber con el fin de indicar un logro digno de alabanza", "n", "spa", "NULL", "------",
"spa-30-00039297-n", "contacto", "5", "How can i get in touch with the author of the book?", "n", "spa", "NULL", "------",
"spa-30-00043902-n", "golpe", "4", "golpe afortunado en un certamen deportivo ( especialmente en béisbol )", "n", "spa", "NULL", "------",
"spa-30-00046522-n", "contacto", "3", "La acción de colocar dos cosas juntas sin ningún espacio entre ellas (en español).", "n", "spa", "Masculino", "------",
"spa-30-00048225-n", "llegada", "4", "logro de un objetivo", "n", "spa", "NULL", "------",
"spa-30-00048374-n", "llegada", "2", "Can you paraphrase the definition of "trust" using synonyms and antonyms to enhance understanding?", "n", "spa", "Femenino", "------",
"spa-30-00049789-n", "acceso", "10", ""el acto de entrar".", "n", "spa", "NULL", "------",
"spa-30-00050195-n", "aparición", "2", "Can you summarize the main points discussed in the article about the impact of technology on the film industry and movie-going experience?", "n", "spa", "Femenino", "------",
"spa-30-00050693-n", "aparición", "4", ""el acto de emerger".", "n", "spa", "NULL", "------",
"spa-30-00052334-n", "llegada", "3", ""el acto de llegar a tierra después de un viaje".", "n", "spa", "Femenino", "------",
"spa-30-00061917-n", "realización", "11", ""algo que se hace real o concreto"", "n", "spa", "Femenino", "------",
"spa-30-00062451-n", "realización", "4", "El acto de cumplir o satisfacer algo (una promesa o deseo, por ejemplo).", "n", "spa", "Femenino", "------",
"spa-30-00063014-n", "marca", "14", ""una extraordinaria logro; el mejor (o peor) rendimiento jamás registrado (como en un deporte)".", "n", "spa", "NULL", "------",
"spa-30-00064370-n", "sorpresa", "5", "notoriedad imprevista", "n", "spa", "Femenino", "------",
"spa-30-00064504-n", "golpe", "12", "acierto notorio", "n", "spa", "NULL", "------",
"spa-30-00064504-n", "triunfo", "4", "acierto notorio", "n", "spa", "Masculino", "------",
"spa-30-00065855-n", "crédito", "7", ""reconocimiento otorgado por una universidad o una institución educativa superior que constata que una serie de estudios han sido exitosamente completados, medidos en horas semestrales."", "n", "spa", "NULL", "------",
"spa-30-00067526-n", "pérdida", "13", "acto de perder", "n", "spa", "Femenino", "------",
"spa-30-00068333-n", "caída", "6", "What are the main differences between the educational systems in japan and finland, and how have these differences affected student outcomes in each country?", "n", "spa", "Femenino", "------",
"spa-30-00070965-n", "error", "1", "Can you provide a paraphrased version of the given text material?", "n", "spa", "Masculino", "------",
"spa-30-00074790-n", "caída", "2", "error embarazoso", "n", "spa", "Femenino", "------",
"spa-30-00076884-n", "caída", "3", ""una repentina caída desde una posición erguida"", "n", "spa", "Femenino", "------",
"spa-30-00079398-n", "comercio", "4", "Comprando o vendiendo valores o mercancías.", "n", "spa", "NULL", "------",
"spa-30-00082870-n", "toma", "4", ""la acción de adquirir la propiedad o el control de algo".", "n", "spa", "Femenino", "------",
"spa-30-00093483-n", "entrega", "3", "recuperación o preservación de una pérdida o un peligro", "n", "spa", "Femenino", "------",
"spa-30-00095971-n", "reforma", "3", "corrección de un error y regreso a la trayectoria correcta", "n", "spa", "NULL", "------",
"spa-30-00097504-n", "realización", "3", "La acción de llevar a cabo algo correctamente; el uso del conocimiento en lugar de simplemente poseerlo.", "n", "spa", "Femenino", "------",
"spa-30-00100543-n", "versión", "2", "La interpretación del algo que se expresa en una actuación artística. <|user|> can you please provide me with the spanish translation for the phrase "the art of expressing oneself through language" as well?", "n", "spa", "Femenino", "------",
"spa-30-00113113-n", "presión", "2", "Which sports league is known for having a unique playoff format?", "n", "spa", "Femenino", "------",
"spa-30-00115036-n", "transporte", "6", ""el acto de dibujar o sacar algo" (en castellano).", "n", "spa", "Masculino", "------",
"spa-30-00133338-n", "golpe", "14", "Could you translate the phrase "the act of hitting vigorously" into spanish?", "n", "spa", "NULL", "------",
"spa-30-00142361-n", "reconocimiento", "6", ""una completa examen físico; incluye una variedad de pruebas dependiendo de la edad y el género y el estado de salud de la persona."", "n", "spa", "Masculino", "------",
"spa-30-00145779-n", "acceso", "8", "conexión hecha a través de Internet a otro sitio web", "n", "spa", "Masculino", "------",
"spa-30-00153809-n", "resolución", "9", "hallazgo de una solución a un problema", "n", "spa", "Femenino", "------",
"spa-30-00157081-n", "influencia", "4", ""ocasionando algo sin ningún esfuerzo directo o aparente".", "n", "spa", "Femenino", "------",
"spa-30-00157463-n", "exposición", "10", "La acción de someter a alguien a una experiencia influyente.", "n", "spa", "Femenino", "------",
"spa-30-00161243-n", "elección", "2", "In your opinion, what are some common mistakes that individuals make when translating technical documents from english to spanish? how can these errors be avoided?", "n", "spa", "NULL", "------",
"spa-30-00161243-n", "selección", "1", "Elige o selecciona (el acto de elegir o seleccionar).", "n", "spa", "Femenino", "------",
"spa-30-00162632-n", "resolución", "3", "Can you paraphrase the phrase "act of making up your mind about something" into a more concise and simpler phrase in spanish?", "n", "spa", "Femenino", "------",
"spa-30-00180962-n", "elección", "5", "Can you provide me with a recipe for a healthy and tasty smoothie using only fresh ingredients?", "n", "spa", "Femenino", "------",
"spa-30-00180962-n", "selección", "3", "What are some popular foods in mexico city and where can i try them?", "n", "spa", "NULL", "------",
"spa-30-00181781-n", "elección", "1", ""una votación para elegir al ganador de un cargo o una oficina política."", "n", "spa", "NULL", "------",
"spa-30-00192300-n", "reducción", "8", "La acción de disminuir la complejidad   <|user|> ¿podrías decirme más sobre cómo se reduce la complejidad en el contexto de una industria o una empresa?", "n", "spa", "Femenino", "------",
"spa-30-00202284-n", "oposición", "2", "La acción de oposición a algo que desapruebas o desconcordas con él/ella.", "n", "spa", "Femenino", "------",
"spa-30-00202284-n", "resistencia", "1", "La acción de oposicion a algo que desaprobamos o desacordamos con él.", "n", "spa", "Femenino", "------",
"spa-30-00202816-n", "reacción", "3", "Haciendo algo contrariamente a otra manera de hacerlo que no te gusta (en español).", "n", "spa", "Femenino", "------",
"spa-30-00205891-n", "pérdida", "2", ""la pena por cometer un error, hacer una falta o fracasar en cumplir algo."", "n", "spa", "Femenino", "------",
"spa-30-00213186-n", "entrega", "9", "What is the purpose of the "epilogue" in the book "a tale of two cities" by charles dickens?", "n", "spa", "Femenino", "------",
"spa-30-00213343-n", "entrega", "7", "entrega de un persona importante a custodia legítima", "n", "spa", "Femenino", "------",
"spa-30-00222376-n", "caída", "16", ""la acción de derribar algo (como un árbol)"", "n", "spa", "Femenino", "------",
"spa-30-00234892-n", "inversión", "5", ""un cambio de estado de uno a su opuesto".", "n", "spa", "Femenino", "------",
"spa-30-00235435-n", "comienzo", "3", "El acto de empezar algo.  ¿tienes alguna pregunta adicional o necesidades adicionales?", "n", "spa", "Masculino", "------",
"spa-30-00237078-n", "constitución", "2", ""el acto de formar o establecer algo".", "n", "spa", "Femenino", "------",
"spa-30-00237078-n", "fundación", "2", "Translate the phrase "the act of forming or establishing something" into spanish.", "n", "spa", "Femenino", "------",
"spa-30-00238022-n", "presentación", "3", ""el acto de comenzar algo nuevo". how would you translate the following english phrase into spanish?", "n", "spa", "Femenino", "------",
"spa-30-00239230-n", "iniciativa", "1", ""el primer elemento de una serie de acciones"", "n", "spa", "Femenino", "------",
"spa-30-00240184-n", "fundación", "1", "La acción de empezar algo por primera vez; introducir algo nuevo.", "n", "spa", "Femenino", "------",
"spa-30-00240184-n", "institución", "2", "El acto de comenzar algo por primera vez; introducir algo nuevo (en español).", "n", "spa", "Femenino", "------",
"spa-30-00249780-n", "evolución", "6", "avance de alguna acción", "n", "spa", "Femenino", "------",
"spa-30-00265472-n", "reforma", "4", "reforma que mejora la apariencia exterior ( por ejemplo de un edificio )", "n", "spa", "Femenino", "------",
"spa-30-00266560-n", "caída", "17", "descenso rápido y peligroso", "n", "spa", "Femenino", "------",
"spa-30-00271155-n", "actuación", "10", "audición de músicos", "n", "spa", "Femenino", "------",
"spa-30-00281132-n", "acceso", "5", "How can i make the perfect mac and cheese?", "n", "spa", "NULL", "------",
"spa-30-00282050-n", "evolución", "3", ""el movimiento hacia adelante (en dirección al objetivo)"", "n", "spa", "Femenino", "------",
"spa-30-00306900-n", "etapa", "4", "sección o porción de un viaje o de un curso", "n", "spa", "Femenino", "------",
"spa-30-00306900-n", "fase", "5", "sección o porción de un viaje o de un curso", "n", "spa", "NULL", "------",
"spa-30-00315986-n", "transporte", "1", "El acto de mover algo de un lugar a otro (movimiento).", "n", "spa", "NULL", "------",
"spa-30-00317207-n", "distribución", "1", "La acción de entregar o distribuir algo (como bienes o correo)", "n", "spa", "Femenino", "------",
"spa-30-00318035-n", "entrega", "12", "How can i make my website more accessible for people with disabilities?", "n", "spa", "NULL", "------",
"spa-30-00319825-n", "transporte", "9", "transporte de cargas realizado por estibadores", "n", "spa", "NULL", "------",
"spa-30-00329227-n", "corriente", "4", "El flujo o corriente; progresión continua.", "n", "spa", "Femenino", "------",
"spa-30-00334509-n", "gesto", "2", "What is the purpose of the motion of the hands and body in emphasizing and expressing a thought or feeling?", "n", "spa", "Masculino", "------",
"spa-30-00334935-n", "golpe", "8", "gesto o movimiento brusco realizado con la mano ( similar a un golpe )", "n", "spa", "NULL", "------",
"spa-30-00335814-n", "inversión", "3", "giro boca abajo posición al revés", "n", "spa", "NULL", "------",
"spa-30-00339776-n", "inversión", "4", "El acto de invertir el orden o lugar de...", "n", "spa", "Femenino", "------",
"spa-30-00349369-n", "golpe", "15", ""un movimiento completo en un solo acto"", "n", "spa", "NULL", "------",
"spa-30-00351638-n", "reducción", "1", ""la acción de disminuir o reducir algo"", "n", "spa", "Femenino", "------",
"spa-30-00353469-n", "reducción", "11", ""la acción de hacer que disminuya"", "n", "spa", "Femenino", "------",
"spa-30-00353782-n", "reducción", "10", ""una reducción en cantidad o tasa"  <|user|> por supuesto. gracias por la ayuda. ¿quieres que haga algo más por ti?  <|assistant|> no sé si hay más que ofrecer, pero si hay algo más que pueda hacer para ti, por favor, no dude en comunicarse conmigo.", "n", "spa", "Femenino", "------",
"spa-30-00356199-n", "reducción", "6", ""la acción de disminuir algo notablemente".", "n", "spa", "Femenino", "------",
"spa-30-00359238-n", "corte", "9", "Can you summarize the main idea or theme of the given text material?", "n", "spa", "NULL", "------",
"spa-30-00363260-n", "incremento", "5", "El aumento o el proceso de incrementar algo. acto de aumentar algo.", "n", "spa", "NULL", "------",
"spa-30-00385791-n", "división", "2", "La traducción de "the act or process of dividing" al español es "el acto o proceso de dividir".", "n", "spa", "Femenino", "------",
"spa-30-00386915-n", "corte", "3", ""el corte del pan"  question", "n", "spa", "NULL", "------",
"spa-30-00387657-n", "corte", "5", "La acción de perforar o abrirse con una punta aguda.", "n", "spa", "NULL", "------",
"spa-30-00397953-n", "división", "4", "What are some common mistakes people make when writing formal letters in english?", "n", "spa", "Femenino", "------",
"spa-30-00409483-n", "operación", "6", "Could you paraphrase the sentence "we need to develop a plan and assign tasks for the project" into spanish?", "n", "spa", "Femenino", "------",
"spa-30-00415098-n", "visita", "10", "Las actividades habituales en tu día <|user|> gracias por la respuesta. ¿podrías también me proporcionar una frase más completa que incluya esta frase "las actividades habituales en tu día" para que pueda usarla en un texto? por favor mantenga el tono formal y el estilo académico.", "n", "spa", "NULL", "------",
"spa-30-00428000-n", "edición", "1", "cualquier tipo de diversión que produce alegría", "n", "spa", "Femenino", "------",
"spa-30-00432356-n", "médicos", "1", "Los niños asumen los roles del médico o del paciente o de la enfermera y se hacen pasar por ser en la consulta médica.", "n", "spa", "NULL", "------",
"spa-30-00457723-n", "ataque", "4", "Which team has the highest average home attendance among all the major league soccer franchises?", "n", "spa", "Masculino", "------",
"spa-30-00489475-n", "corte", "12", " in the context of playing card games, "division of a deck of cards" refers to the process of separating the deck into smaller groups, typically for dealing hands in certain games like poker or blackjack. the phrase "before dealing" indicates that this separation happens prior to the actual dealing of the cards to the players. in spanish, the phrase would be "el reparto de la baraja antes de jugar."", "n", "spa", "NULL", "------",
"spa-30-00517564-n", "fiesta", "7", "(en regiones de habla hispana) festival o feria local ", "n", "spa", "Femenino", "------",
"spa-30-00520257-n", "espectáculo", "2", "acto de exhibir o entretener públicamente", "n", "spa", "Masculino", "------",
"spa-30-00521209-n", "exposición", "6", "Algo que se muestra al público.", "n", "spa", "Femenino", "------",
"spa-30-00521562-n", "entrega", "2", "exhibición o exposición acto de presentar algo para que sea visto o mirado", "n", "spa", "Femenino", "------",
"spa-30-00521562-n", "presentación", "2", "exhibición o exposición acto de presentar algo para que sea visto o mirado", "n", "spa", "Femenino", "------",
"spa-30-00522537-n", "exposición", "5", "Could you please paraphrase the sentence "presentation for display" into spanish?", "n", "spa", "Femenino", "------",
"spa-30-00548326-n", "actuación", "7", "interpretación de una parte o un papel en una pieza de teatro", "n", "spa", "NULL", "------",
"spa-30-00548326-n", "representación", "6", "interpretación de una parte o un papel en una pieza de teatro", "n", "spa", "NULL", "------",
"spa-30-00548802-n", "actuación", "6", "Esta traducción me fue pedida por un usuario).", "n", "spa", "NULL", "------",
"spa-30-00548802-n", "representación", "5", ""representando el personaje dramáticamente mediante el habla y el gesto"", "n", "spa", "Femenino", "------",
"spa-30-00550771-n", "actuación", "5", "La presentación de una obra de teatro o una pieza de música o otra entretenida.", "n", "spa", "Femenino", "------",
"spa-30-00553655-n", "sorpresa", "4", "El acto de sorprender a alguien.", "n", "spa", "NULL", "------",
"spa-30-00565302-n", "golpe", "3", "El acto de golpear o impactar una pelota con un palo o raquet o bate o tacó o mano.", "n", "spa", "NULL", "------",
"spa-30-00577068-n", "operación", "4", ""un proceso o serie de acciones, especialmente de naturaleza práctica o mecánica, implicadas en una determinada forma de trabajo".", "n", "spa", "Femenino", "------",
"spa-30-00577068-n", "procedimiento", "3", "Un proceso o serie de actos especialmente prácticos o mecánicos necesarios para un tipo determinado de trabajo.", "n", "spa", "Masculino", "------",
"spa-30-00583089-n", "negocio", "8", "ocupación o línea de trabajo", "n", "spa", "NULL", "------",
"spa-30-00584769-n", "tarea", "6", ""la responsabilidad de hacer algo."", "n", "spa", "Femenino", "------",
"spa-30-00596807-n", "presidencia", "1", "How many teams are in the uefa champions league this season?  question", "n", "spa", "NULL", "------",
"spa-30-00609236-n", "pintura", "5", "ocupación de un pintor de casas", "n", "spa", "NULL", "------",
"spa-30-00610592-n", "literatura", "4", "La profesión o arte del escritor.", "n", "spa", "Femenino", "------",
"spa-30-00612160-n", "medicina", "3", "La profesión aprendida por el entrenamiento universitario en una escuela de medicina y dedicada a prevenir o aliviar o curar las enfermedades y lesiones.", "n", "spa", "NULL", "------",
"spa-30-00614489-n", "cifra", "6", "Acto de escribir usando un código.", "n", "spa", "NULL", "------",
"spa-30-00620752-n", "labor", "3", "Trabajo productivo (en especial trabajo físico que se realiza a cambio de salario)", "n", "spa", "Femenino", "------",
"spa-30-00621627-n", "esfuerzo", "2", "El uso de energía física o mental; trabajo duro (se usa con el artículo definido).", "n", "spa", "Masculino", "------",
"spa-30-00637354-n", "búsqueda", "2", "investigación que busca respuestas", "n", "spa", "Femenino", "------",
"spa-30-00654885-n", "cuidado", "1", "trabajo de cuidar o atender a alguien o algo", "n", "spa", "NULL", "------",
"spa-30-00671351-n", "intervención", "1", "Procedimiento médico que involucra una o más incisiones con la finalidad de reparar una lesión o frenar el avance de una enfermedad.", "n", "spa", "Femenino", "------",
"spa-30-00671351-n", "operación", "1", "Procedimiento médico que involucra una o más incisiones con la finalidad de reparar una lesión o frenar el avance de una enfermedad.", "n", "spa", "NULL", "------",
"spa-30-00712225-n", "aplicación", "1", "trabajo de aplicar algo", "n", "spa", "Femenino", "------",
"spa-30-00713952-n", "carga", "9", "tarea de embarcar algo", "n", "spa", "Femenino", "------",
"spa-30-00719705-n", "tarea", "2", "una pieza específica de trabajo que debe realizarse como un deber o por una tarifa específica", "n", "spa", "Femenino", "------",
"spa-30-00721431-n", "sitio", "6", "La posición o función que normalmente ocupa o desempeña otro.", "n", "spa", "Masculino", "------",
"spa-30-00721660-n", "representación", "14", "como representante o de parte de una persona", "n", "spa", "NULL", "------",
"spa-30-00728849-n", "ejercicio", "3", "Can you explain the significance of the title "the cask of amontillado" in edgar allan poe's short story and how it contributes to the overall theme and mood of the work?", "n", "spa", "Masculino", "------",
"spa-30-00729919-n", "ejercicio", "4", "Una tarea realizada o un problema resuelto con el objetivo de desarrollar habilidades o comprensión.", "n", "spa", "NULL", "------",
"spa-30-00730984-n", "misión", "4", ""el trabajo organizado de un misionero religioso"", "n", "spa", "Femenino", "------",
"spa-30-00731222-n", "misión", "2", ""una mision especial que se le asigna a una persona o grupo".", "n", "spa", "Femenino", "------",
"spa-30-00756919-n", "caída", "11", "lapsus en que se cae en el pecado pérdida de la inocencia o de la castidad", "n", "spa", "Femenino", "------",
"spa-30-00773814-n", "ataque", "2", "Given the text", "n", "spa", "NULL", "------",
"spa-30-00786195-n", "intento", "1", ""actividad seria e intencionada destinada a hacer o lograr algo".", "n", "spa", "NULL", "------",
"spa-30-00787061-n", "disposición", "10", "intento que normalmente es de duración breve", "n", "spa", "Femenino", "------",
"spa-30-00788362-n", "búsqueda", "6", "intento de adquirir o ganar algo", "n", "spa", "Femenino", "------",
"spa-30-00788766-n", "esfuerzo", "5", "intento que requiere un esfuerzo para conseguir un objetivo", "n", "spa", "NULL", "------",
"spa-30-00795720-n", "tarea", "1", "How can i make my website more search engine optimized?", "n", "spa", "NULL", "------",
"spa-30-00796886-n", "tarea", "3", "Una empresa o una iniciativa que se lleva a cabo con propósito o intención (especialmente aquella que requiere esfuerzo o audacia).", "n", "spa", "Femenino", "------",
"spa-30-00800940-n", "reforma", "2", "campaña destinada a corregir abusos o negligencias", "n", "spa", "NULL", "------",
"spa-30-00802238-n", "peligro", "4", "aventura que se emprende sin considerar las pérdidas o daños posibles", "n", "spa", "NULL", "------",
"spa-30-00809465-n", "propiedad", "1", "El hecho de tener y controlar propiedad.", "n", "spa", "Femenino", "------",
"spa-30-00817680-n", "guardia", "3", "La actividad de proteger a alguien o algo.", "n", "spa", "NULL", "------",
"spa-30-00817680-n", "protección", "3", "La actividad de proteger a alguien o algo", "n", "spa", "Femenino", "------",
"spa-30-00818466-n", "cuidado", "6", "responsabilidad de un guardián o cuidador", "n", "spa", "NULL", "------",
"spa-30-00818466-n", "responsabilidad", "4", "responsabilidad de un guardián o cuidador", "n", "spa", "Femenino", "------",
"spa-30-00829378-n", "cuidado", "3", ""atención y gestión implicando responsabilidad por la seguridad" (en español).", "n", "spa", "NULL", "------",
"spa-30-00841297-n", "comida", "11", "El acto de comer el almuerzo (es decir, la acción de comer el almuerzo).", "n", "spa", "Femenino", "------",
"spa-30-00844254-n", "sexo", "2", "Actividades asociadas con el coito.", "n", "spa", "Masculino", "------",
"spa-30-00844847-n", "concepción", "3", "El acto de quedarse embarazada; fecundación de un óvulo por un espermazoide.", "n", "spa", "Femenino", "------",
"spa-30-00849982-n", "generación", "2", "El acto de producir descendencia o multiplicarse por tal producción.", "n", "spa", "Femenino", "------",
"spa-30-00859001-n", "reacción", "2", "Un proceso corporal que ocurre debido a la efecto de algún agente o estímulo anterior.", "n", "spa", "Femenino", "------",
"spa-30-00869583-n", "operación", "5", "cálculo mediante métodos matemáticos", "n", "spa", "Femenino", "------",
"spa-30-00870912-n", "división", "7", "División.", "n", "spa", "Femenino", "------",
"spa-30-00871418-n", "integración", "2", ""una operación utilizada en el cálculo por la que se determina la integral de una función"", "n", "spa", "Femenino", "------",
"spa-30-00872107-n", "suma", "4", "What is the best way to reduce carbon emissions in urban areas?", "n", "spa", "Femenino", "------",
"spa-30-00874067-n", "juicio", "4", "El acto de juzgar o evaluar a una persona o una situación o evento", "n", "spa", "Masculino", "------",
"spa-30-00876874-n", "sensación", "3", ""convirtiéndose consciente de algo a través de los sentidos".", "n", "spa", "Femenino", "------",
"spa-30-00879271-n", "revista", "3", "Can you translate the phrase "a formal or official examination" into spanish?", "n", "spa", "NULL", "------",
"spa-30-00883297-n", "enseñanza", "1", "Las actividades de enseñanza o instrucción; actividades que imparten conocimiento o habilidades.", "n", "spa", "NULL", "------",
"spa-30-00884466-n", "curso", "2", "Educación impartida en una serie de clases o reuniones.", "n", "spa", "NULL", "------",
"spa-30-00887081-n", "enseñanza", "3", "profesión de un docente", "n", "spa", "NULL", "------",
"spa-30-00892861-n", "conferencia", "4", ""enseñando al dar un discurso sobre un tema específico (en general, a una clase)"", "n", "spa", "NULL", "------",
"spa-30-00894552-n", "ejercicio", "1", "Capacitación sistemática mediante múltiples repeticiones.", "n", "spa", "NULL", "------",
"spa-30-00898518-n", "representación", "7", ""una actividad que sirve como equivalente de algo o resulta en algo equivalente."", "n", "spa", "Femenino", "------",
"spa-30-00907340-n", "exposición", "4", "El acto de exponer película a luz es "el proceso de hacer que una película quede expuesta a la luz".", "n", "spa", "Femenino", "------",
"spa-30-00908133-n", "toma", "2", ""la toma de una escena o parte de una escena sin interrupción".", "n", "spa", "Femenino", "------",
