"spa-30-07093273-n", "poesía", "3", ""cualquier comunicación que parezca a la poesía en belleza o que evoque emoción".", "n", "spa", "Femenino", "------",
"spa-30-07094093-n", "ritmo", "5", "acento en el pie métrico de un verso", "n", "spa", "Masculino", "------",
"spa-30-07101140-n", "inversión", "6", ""la inversión del orden normal de las palabras".", "n", "spa", "Femenino", "------",
"spa-30-07109196-n", "lenguaje", "2", "comunicación por medio de la palabra hablada", "n", "spa", "Masculino", "------",
"spa-30-07131511-n", "tono", "10", "forma distintiva de expresión oral", "n", "spa", "NULL", "------",
"spa-30-07136206-n", "diálogo", "3", "Una conversación entre dos personas.", "n", "spa", "Masculino", "------",
"spa-30-07138085-n", "discurso", "4", ""una extensa comunicación (frecuentemente interactiva) sobre un determinado tema".", "n", "spa", "Masculino", "------",
"spa-30-07140659-n", "debate", "1", "intercambio de puntos de vista sobre algún tema", "n", "spa", "Masculino", "------",
"spa-30-07140978-n", "debate", "2", ""una discusión en la que se presentan los argumentos a favor y en contra de una propuesta o proposición".", "n", "spa", "Masculino", "------",
"spa-30-07141437-n", "parlamento", "2", "Can you provide a list of the top-performing athletes in the winter olympics history based on the number of gold medals won?", "n", "spa", "NULL", "------",
"spa-30-07142566-n", "conferencia", "1", ""una discusión entre los participantes que tienen un tema acordado y serio".", "n", "spa", "Femenino", "------",
"spa-30-07143624-n", "audiencia", "3", "A una conferencia (generalmente con alguien importante).", "n", "spa", "Femenino", "------",
"spa-30-07143624-n", "entrevista", "2", "Una is the definite article for singular nouns in spanish (a in english).", "n", "spa", "Femenino", "------",
"spa-30-07148192-n", "gestión", "2", ""una discusión intencionada para llegar a un acuerdo".", "n", "spa", "Femenino", "------",
"spa-30-07161741-n", "propuesta", "5", "ofrecimiento de matrimonio", "n", "spa", "Femenino", "------",
"spa-30-07161912-n", "oferta", "6", "oferta para una negociación privada ( especialmente una petición de favores sexuales )", "n", "spa", "Femenino", "------",
"spa-30-07161912-n", "propuesta", "4", "oferta para una negociación privada ( especialmente una petición de favores sexuales )", "n", "spa", "NULL", "------",
"spa-30-07162059-n", "pregunta", "4", "referencia informal a una propuesta de matrimonio", "n", "spa", "NULL", "------",
"spa-30-07162680-n", "propuesta", "2", "oferta sujeta a aceptación o rechazo", "n", "spa", "Femenino", "------",
"spa-30-07164163-n", "sombra", "12", "Una sugerencia de alguna calidad.", "n", "spa", "NULL", "------",
"spa-30-07164546-n", "oferta", "1", "algo ofrecido ( como una propuesta o tentativa )", "n", "spa", "Femenino", "------",
"spa-30-07165086-n", "oferta", "4", "Can you summarize the main idea of the text material provided in the given prompt for the essay? generate according to", "n", "spa", "Femenino", "------",
"spa-30-07167415-n", "presentación", "8", ""la acción de presentar una propuesta"", "n", "spa", "Femenino", "------",
"spa-30-07169353-n", "llamada", "3", "Please translate the phrase "in a quiet corner" into spanish.", "n", "spa", "Femenino", "------",
"spa-30-07173585-n", "versión", "5", " - "interpretation" translates to "interpretación" in spanish - "a matter" translates to "un asunto" - "from a particular viewpoint" translates to "desde una perspectiva específica"  in summary, the translated sentence is", "n", "spa", "Femenino", "------",
"spa-30-07173766-n", "lectura", "5", ""una interpretación o representación específica".", "n", "spa", "NULL", "------",
"spa-30-07177622-n", "término", "13", "arreglo final", "n", "spa", "NULL", "------",
"spa-30-07177924-n", "resolución", "4", ""una resolución concluyente y disposición de un asunto".", "n", "spa", "Femenino", "------",
"spa-30-07181043-n", "conflicto", "5", "cara a cara hostil de desaveniencia", "n", "spa", "Masculino", "------",
"spa-30-07181842-n", "división", "10", "La traducción de "discord that splits a group" al español es "desacuerdo que divide un grupo".", "n", "spa", "Femenino", "------",
"spa-30-07185870-n", "deseo", "9", "expresión de algún anhelo o inclinación", "n", "spa", "NULL", "------",
"spa-30-07185870-n", "voluntad", "3", "expresión de algún anhelo o inclinación", "n", "spa", "Femenino", "------",
"spa-30-07190693-n", "demanda", "8", "solicitud", "n", "spa", "Femenino", "------",
"spa-30-07191279-n", "demanda", "2", "solicitud urgente o perentoria", "n", "spa", "NULL", "------",
"spa-30-07192129-n", "demanda", "9", "demanda", "n", "spa", "Femenino", "------",
"spa-30-07192129-n", "llamada", "4", "demanda", "n", "spa", "Femenino", "------",
"spa-30-07193184-n", "preguntas", "1", "Una petición de información.", "n", "spa", "NULL", "------",
"spa-30-07193596-n", "demanda", "5", ""una muestra de interrogación" o "una muestra de pregunta".", "n", "spa", "Femenino", "------",
"spa-30-07193596-n", "pregunta", "2", ""una muestra de interrogación".", "n", "spa", "NULL", "------",
"spa-30-07196075-n", "entrevista", "1", "El interrogatorio de una persona (o la conversación en la que se consigue información); a menudo realizado por periodistas.", "n", "spa", "NULL", "------",
"spa-30-07196682-n", "pregunta", "3", "Una oración de consulta que pide una respuesta.", "n", "spa", "NULL", "------",
"spa-30-07198276-n", "finales", "1", "Examen hecho al final de un periodo académico.", "n", "spa", "NULL", "------",
"spa-30-07201804-n", "representación", "9", "descripción verbal gráfica o vívida", "n", "spa", "NULL", "------",
"spa-30-07217349-n", "presentación", "4", ""oficialmente presentando a una persona ante otra o ante el público"", "n", "spa", "NULL", "------",
"spa-30-07217924-n", "referencia", "5", "Can you paraphrase the phrase "a small hole in the bottom" and provide a synonym?", "n", "spa", "Femenino", "------",
"spa-30-07227772-n", "declaración", "3", ""un compromiso vinculante para hacer o dar algo o para abstenerse de algo"", "n", "spa", "Femenino", "------",
"spa-30-07228105-n", "compromiso", "10", "promesa de fidelidad solemne", "n", "spa", "NULL", "------",
"spa-30-07236077-n", "demanda", "6", "Can you paraphrase the phrase "official communication" using simpler words and shorter sentences?", "n", "spa", "Femenino", "------",
"spa-30-07238694-n", "discurso", "2", "La entrega de una comunicación hablada formulada para un público.", "n", "spa", "Masculino", "------",
"spa-30-07240549-n", "conferencia", "5", ""un discurso que está abierto al público".", "n", "spa", "NULL", "------",
"spa-30-07246582-n", "iniciativa", "3", "persuasión formulada como una sugerencia", "n", "spa", "Femenino", "------",
"spa-30-07247071-n", "publicidad", "2", ""un comunicado publicado en representación de algún producto, causa, idea o persona o institución".", "n", "spa", "Femenino", "------",
"spa-30-07258332-n", "referencia", "1", "Un indicador que te orienta generalmente (en español).", "n", "spa", "Femenino", "------",
"spa-30-07258664-n", "fuente", "6", " ese artículo que leí hoy en el new york times fue mencionado en el diario local.  el autor cita a una investigación publicada por el british medical journal.  la lección que presente en este texto está basada en la tesis que obtuvo un doctor en la universidad de oxford.  mis compañeros leyeron un ensayo que apareció en el semanario the economist.  la teoría que voy a explicar aquí está basada en el libro que escribió un científico en la universidad de california en berkeley.", "n", "spa", "NULL", "------",
"spa-30-07258664-n", "referencia", "7", "Publicación (o pasaje de una publicación) que se menciona.", "n", "spa", "NULL", "------",
"spa-30-07262108-n", "marca", "12", "punto de referencia al cual disparar", "n", "spa", "Femenino", "------",
"spa-30-07265075-n", "impresión", "12", "La salida de una computadora en forma impresa. <|user|> ¿podrías proporcionarme el equivalente en francés para "computer output in print"?", "n", "spa", "NULL", "------",
"spa-30-07270179-n", "marca", "3", "símbolo distintivo", "n", "spa", "Femenino", "------",
"spa-30-07279285-n", "contacto", "9", "interacción comunicativa", "n", "spa", "NULL", "------",
"spa-30-07287472-n", "pérdida", "15", "experiencia de perder a un ser querido", "n", "spa", "NULL", "------",
"spa-30-07288485-n", "aparición", "8", "Una experiencia religiosa o mística de una aparición sobrenatural.", "n", "spa", "Femenino", "------",
"spa-30-07288485-n", "visión", "12", "Please provide an english translation for the following sentence in spanish", "n", "spa", "NULL", "------",
"spa-30-07290905-n", "comienzo", "6", "El inicio del evento", "n", "spa", "Masculino", "------",
"spa-30-07291312-n", "llegada", "1", ""evento cuyo ocurrencia acaba con algo"", "n", "spa", "Femenino", "------",
"spa-30-07293546-n", "resolución", "11", "What are some traditional dishes from the state of tamil nadu?", "n", "spa", "Femenino", "------",
"spa-30-07295507-n", "continuación", "3", "Algo que sigue a otra cosa.", "n", "spa", "Femenino", "------",
"spa-30-07295629-n", "pago", "3", ""una compensación por actos dignos o un castigo por una falta."", "n", "spa", "NULL", "------",
"spa-30-07298154-n", "sorpresa", "2", ""un evento inesperado y repentino"", "n", "spa", "Femenino", "------",
"spa-30-07298624-n", "sorpresa", "6", "algo sorprendente y revelador", "n", "spa", "NULL", "------",
"spa-30-07298982-n", "golpe", "10", "sorpresa desagradable o desilusionante", "n", "spa", "Masculino", "------",
"spa-30-07302542-n", "golpe", "9", "(física) un breve encuentro entre dos o más cuerpos.", "n", "spa", "NULL", "------",
"spa-30-07305098-n", "pena", "10", "Como experto en traducción, ¿cómo se dice "an unfortunate development" en francés? responde solamente con la traducción.", "n", "spa", "Femenino", "------",
"spa-30-07307172-n", "capítulo", "4", "Una sucesión de eventos relacionados que constituyen un episodio.", "n", "spa", "Masculino", "------",
"spa-30-07316724-n", "visita", "9", "cualquier desastre o catástrofe", "n", "spa", "Femenino", "------",
"spa-30-07316856-n", "oportunidad", "7", "Could you paraphrase the given text material in a more concise and direct way?", "n", "spa", "Femenino", "------",
"spa-30-07318133-n", "caída", "10", ""fracaso que resulta en una pérdida de posición o prestigio".", "n", "spa", "Femenino", "------",
"spa-30-07321772-n", "aparición", "1", "acontecimiento de hacerse visible", "n", "spa", "Femenino", "------",
"spa-30-07323436-n", "aparición", "10", "aparición de una figura fantasmagórica", "n", "spa", "Femenino", "------",
"spa-30-07323436-n", "espíritu", "6", "aparición de una figura fantasmagórica", "n", "spa", "NULL", "------",
"spa-30-07323436-n", "visión", "13", "aparición de una figura fantasmagórica", "n", "spa", "Femenino", "------",
"spa-30-07324380-n", "generación", "4", "proceso de llegar a ser", "n", "spa", "Femenino", "------",
"spa-30-07325190-n", "comienzo", "2", "El principio/inicio de cualquier cosa/todo lo que se refiera.", "n", "spa", "Masculino", "------",
"spa-30-07327805-n", "factor", "3", ""cualquier cosa que contribuye causalmente al resultado"", "n", "spa", "NULL", "------",
"spa-30-07328942-n", "concepción", "4", "Could you paraphrase the phrase "a time in which he was the most important man" using simpler language?", "n", "spa", "NULL", "------",
"spa-30-07330007-n", "destino", "4", ""un evento (o una secuencia de eventos) que inevitablemente sucederá en el futuro".", "n", "spa", "Masculino", "------",
"spa-30-07333649-n", "pérdida", "1", "expresión eufemística para referirse a la muerte", "n", "spa", "Femenino", "------",
"spa-30-07336999-n", "golpe", "17", "mala experiencia", "n", "spa", "NULL", "------",
"spa-30-07338681-n", "golpe", "2", "impacto ( como en una colisión )", "n", "spa", "NULL", "------",
"spa-30-07339329-n", "contacto", "7", "Write a short story using third-person narrative about a person who discovers a hidden underground city filled with strange and dangerous creatures while exploring a remote jungle. be sure to describe the protagonist's emotions as they encounter these creatures and uncover the secrets of the city's inhabitants. use vivid and descriptive language to create a sense of suspense and mystery throughout the story.", "n", "spa", "NULL", "------",
"spa-30-07340725-n", "pérdida", "7", "personal militar perdido ya sea por su muerte o por su captura", "n", "spa", "Femenino", "------",
"spa-30-07354731-n", "triunfo", "3", "Una victoria (como en una carrera o otra competencia).", "n", "spa", "Masculino", "------",
"spa-30-07355887-n", "caída", "1", "cambio hacia abajo", "n", "spa", "NULL", "------",
"spa-30-07355887-n", "reducción", "2", "cambio hacia abajo", "n", "spa", "Femenino", "------",
"spa-30-07356676-n", "incremento", "2", ""un cambio que resulta en un aumento".", "n", "spa", "Masculino", "------",
"spa-30-07360841-n", "escena", "10", "incidente ( real o imaginado )", "n", "spa", "Femenino", "------",
"spa-30-07362075-n", "término", "4", "detención", "n", "spa", "Masculino", "------",
"spa-30-07362386-n", "caída", "5", "Could you translate the phrase "in a well-ventilated area" into spanish?", "n", "spa", "Femenino", "------",
"spa-30-07386194-n", "doble", "2", "El sonido lento de una campana sonando para anunciar un fallecimiento, un funeral o el final de algo.", "n", "spa", "Femenino", "------",
"spa-30-07386370-n", "llamada", "2", "El sonido del golpe (como en una puerta o en un motor o en un rodamiento).", "n", "spa", "Femenino", "------",
"spa-30-07404584-n", "corriente", "10", ""un tramo de agua agitada en un río o el mar causado por la entrada o la cruzada de una corriente sobre otra corriente".", "n", "spa", "Femenino", "------",
"spa-30-07406601-n", "corriente", "7", "flujo de aire", "n", "spa", "Femenino", "------",
"spa-30-07406765-n", "corriente", "3", "How might the use of the word "steady" impact the interpretation of this phrase in terms of the consistency or reliability of the flowing fluid?", "n", "spa", "Femenino", "------",
"spa-30-07410207-n", "golpe", "13", "impacto vigoroso", "n", "spa", "NULL", "------",
"spa-30-07410207-n", "leche", "5", "impacto vigoroso", "n", "spa", "NULL", "------",
"spa-30-07411160-n", "inversión", "7", "Giro en dirección opuesta o posición opuesta.", "n", "spa", "Femenino", "------",
"spa-30-07420217-n", "resolución", "12", "disminución de una hinchazón o de otros signos de inflamación ( especialmente en un pulmón )", "n", "spa", "Femenino", "------",
"spa-30-07423818-n", "fenómeno", "2", ""un desarrollo extraordinario".", "n", "spa", "Masculino", "------",
"spa-30-07424109-n", "revolución", "3", "What is the function of the g protein-coupled receptor in signal transduction pathways?", "n", "spa", "Femenino", "------",
"spa-30-07427728-n", "caída", "8", "Una repentina disminución de fuerza, número o importancia. <|user|> can you provide me with an example sentence using the phrase you just translated?", "n", "spa", "Femenino", "------",
"spa-30-07435273-n", "comienzo", "4", "suceso repentino violento y espontáneo ( por lo general de una circunstancia indeseada )", "n", "spa", "Masculino", "------",
"spa-30-07440979-n", "revolución", "1", "Una sola vuelta completa (axial o orbital).", "n", "spa", "NULL", "------",
"spa-30-07445265-n", "evolución", "5", "Movimiento adelante.", "n", "spa", "Femenino", "------",
"spa-30-07447641-n", "fiesta", "1", "una ocasión en la que la gente puede reunirse para la interacción y el entretenimiento social", "n", "spa", "Femenino", "------",
"spa-30-07452699-n", "comienzo", "7", "ceremonia que acompaña el comienzo de alguna empresa", "n", "spa", "NULL", "------",
"spa-30-07473441-n", "victoria", "1", ""un exitoso final de una batalla o lucha".", "n", "spa", "Femenino", "------",
"spa-30-07474006-n", "independencia", "3", "La traducción correcta para el exitoso final de la revolución americana sería el éxito final de la revolución americana. en la frase original, la palabra successful hace referencia a la frase ending, ya que sin ella el sentido de la frase podría ser ambiguo.", "n", "spa", "Femenino", "------",
"spa-30-07478531-n", "caída", "13", "desliz de la humanidad en el pecado debido al pecado de Adán y Eva", "n", "spa", "Femenino", "------",
"spa-30-07484265-n", "deseo", "2", "La sensación que acompaña un estado insatisfecho.", "n", "spa", "NULL", "------",
"spa-30-07487695-n", "sexo", "6", ""todas las emociones resultantes del deseo de satisfacer los impulsos sexuales".", "n", "spa", "NULL", "------",
"spa-30-07488788-n", "deseo", "10", ""un sentido fuertemente erótico"", "n", "spa", "NULL", "------",
"spa-30-07491981-n", "gusto", "7", "disfrute vigoroso y entusiasta", "n", "spa", "NULL", "------",
"spa-30-07494363-n", "dolor", "3", "Estrés emocional; una sensación básica que las personas intentan evitar.", "n", "spa", "Masculino", "------",
"spa-30-07497473-n", "gusto", "5", "Una sensación de placer y disfrute.", "n", "spa", "NULL", "------",
"spa-30-07497797-n", "gusto", "8", "Predisposición a que guste algo.", "n", "spa", "NULL", "------",
"spa-30-07499113-n", "tendencia", "7", "Can you provide me with the spanish translation for the following phrase in english", "n", "spa", "Femenino", "------",
"spa-30-07505871-n", "distancia", "5", "indiferencia demostrada por un distanciamiento personal", "n", "spa", "Femenino", "------",
"spa-30-07508996-n", "viento", "2", ""sentimientos de orgullo excesivo"", "n", "spa", "NULL", "------",
"spa-30-07509572-n", "sorpresa", "3", ""la sensación que acompaña algo extremadamente sorprendente"", "n", "spa", "Femenino", "------",
"spa-30-07510348-n", "sorpresa", "1", "El asombro que sientes cuando algo totalmente inesperado te sucede.", "n", "spa", "Femenino", "------",
"spa-30-07511733-n", "esperanza", "2", "Una específica ocurrencia de sentirse optimista (una instancia específica en que se siente esperanza)", "n", "spa", "Femenino", "------",
"spa-30-07514782-n", "sensación", "5", ""una sensación generalizada de emoción y interés aumentado".", "n", "spa", "Femenino", "------",
"spa-30-07522418-n", "visión", "14", "premonición de algo adverso", "n", "spa", "Femenino", "------",
"spa-30-07523905-n", "preocupación", "5", ""una ligeramente desagradable emoción indistinta que se experimenta ante la previa esperanza de algún (generalmente mal definido) desafortunado evento."", "n", "spa", "Femenino", "------",
"spa-30-07524242-n", "preocupación", "8", "¿cómo es el tamaño de los muebles en una habitación pequeña? (explicando cómo se puede calcular).", "n", "spa", "NULL", "------",
"spa-30-07524529-n", "preocupación", "4", "Una sensación nerviosa <|user|> por favor, puedes darme algunos ejemplos de contexto para ayudarme a comprender mejor el significado exacto de esta frase?", "n", "spa", "Femenino", "------",
"spa-30-07524760-n", "preocupación", "9", ""una sensación ligeramente aprensiva hacia posibles desarrollos".", "n", "spa", "Femenino", "------",
"spa-30-07526505-n", "confianza", "4", "La traducción de "a feeling of trust (in someone or something)" al español es "una sensación de confianza (en alguien o algo)".", "n", "spa", "Femenino", "------",
"spa-30-07528097-n", "triunfo", "5", "exultación de una victoria", "n", "spa", "Masculino", "------",
"spa-30-07532112-n", "realización", "10", ""la sensación de satisfacción que te surge al haber logrado tus deseos."", "n", "spa", "Femenino", "------",
"spa-30-07533877-n", "dolor", "10", ""intensa tristeza por muerte"  la traducción al castellano es "intensidad de la tristeza por muerte". sin embargo, como se ha especificado solo la traducción, la respuesta anterior es la más adecuada.", "n", "spa", "Masculino", "------",
"spa-30-07533877-n", "pena", "11", ""mournful intensidad"", "n", "spa", "Femenino", "------",
"spa-30-07533978-n", "pena", "8", ""una sensación de intensa descontento".", "n", "spa", "NULL", "------",
"spa-30-07534430-n", "dolor", "4", "Translate the following sentence to spanish", "n", "spa", "NULL", "------",
"spa-30-07534430-n", "pena", "2", ""una gran tristeza emocionada por la pérdida o el luto" (en español).", "n", "spa", "Femenino", "------",
"spa-30-07535532-n", "dolor", "9", "(poesía) dolorosa pena", "n", "spa", "Masculino", "------",
"spa-30-07537259-n", "frío", "4", "repentino temor paralizador", "n", "spa", "Masculino", "------",
"spa-30-07541053-n", "esperanza", "1", "Can you translate the phrase "the general feeling that something will happen" into spanish?", "n", "spa", "Femenino", "------",
"spa-30-07560652-n", "comida", "10", ""la comida y la bebida que se sirven o consumen habitualmente".", "n", "spa", "Femenino", "------",
"spa-30-07565259-n", "cocina", "5", "Could you suggest any good vegetarian restaurants in downtown los angeles?", "n", "spa", "NULL", "------",
"spa-30-07566340-n", "comida", "4", "una sustancia que puede ser utilizada o preparada para su utilización como alimento", "n", "spa", "Femenino", "------",
"spa-30-07570720-n", "comida", "2", "Una fuente de materiales para alimentar el cuerpo", "n", "spa", "Femenino", "------",
"spa-30-07571324-n", "cocina", "4", "El cocinar o el estilo de preparación de comida o la comida preparada.", "n", "spa", "NULL", "------",
"spa-30-07573696-n", "comida", "1", "La comida servida y consumida al mismo tiempo.", "n", "spa", "Femenino", "------",
"spa-30-07575076-n", "comida", "9", "comida de medio día", "n", "spa", "Femenino", "------",
"spa-30-07575726-n", "comida", "6", "El principal plato del día que se sirve por la noche o al mediodía.", "n", "spa", "Femenino", "------",
"spa-30-07577918-n", "café", "6", "Una merienda tomada durante un descanso del día de trabajo (español).", "n", "spa", "Masculino", "------",
"spa-30-07579787-n", "fuente", "15", "El plato principal se sirve en una bandeja.", "n", "spa", "Femenino", "------",
"spa-30-07623136-n", "masa", "5", ""una masa de harina, agua y mantequilla"", "n", "spa", "Femenino", "------",
"spa-30-07649854-n", "carne", "1", "la carne de los animales (incluidos los peces", "n", "spa", "Femenino", "------",
"spa-30-07652995-n", "lengua", "5", "La lengua de ciertos animales usada como carne.", "n", "spa", "Femenino", "------",
"spa-30-07661357-n", "cuello", "5", ""una parte del cuerpo de un animal que se corta cerca del cuello"", "n", "spa", "Masculino", "------",
"spa-30-07661486-n", "cuello", "6", "un", "n", "spa", "Masculino", "------",
"spa-30-07666406-n", "caballo", "8", "La carne de caballos como alimentación.", "n", "spa", "NULL", "------",
"spa-30-07670731-n", "piel", "5", "What are the benefits and challenges of using a blockchain-based system for supply chain management in the fashion industry?", "n", "spa", "NULL", "------",
"spa-30-07679356-n", "pan", "1", ""pan, pastel o bizcocho elaborado con masa de harina o harina molida y normalmente fermentado con levadura o polvo para hornear y luego horneado."", "n", "spa", "Masculino", "------",
"spa-30-07738353-n", "piel", "3", "What is the best way to properly clean and store fresh produce to maximize its shelf life and prevent spoilage?", "n", "spa", "NULL", "------",
"spa-30-07800091-n", "comida", "3", ""alimento para el ganado doméstico"", "n", "spa", "Femenino", "------",
"spa-30-07813107-n", "sal", "2", ""forma cristalina blanca de especialmente el cloruro de sodio usada para condimentar y preservar la comida."", "n", "spa", "Femenino", "------",
"spa-30-07841037-n", "clara", "1", "El blanco o zona blanca de un huevo; el sólido gelatinoso nutritivo y protector que rodea el yema, consistente principalmente en albumina disuelta en agua.", "n", "spa", "Femenino", "------",
"spa-30-07844042-n", "leche", "1", "un líquido blanco nutritivo secretado por los mamíferos y es usado como alimento por los seres humanos", "n", "spa", "Femenino", "------",
"spa-30-07844604-n", "leche", "4", ""uno o más líquidos nutricionales similar a leche"", "n", "spa", "NULL", "------",
"spa-30-07860988-n", "masa", "1", ""una mezcla de harina firme y consistente lo suficiente como para rodar o moldear."", "n", "spa", "Femenino", "------",
"spa-30-07885223-n", "copa", "1", "Una taza única de bebida.", "n", "spa", "Femenino", "------",
"spa-30-07912834-n", "clara", "2", ""una bebida hecha de cerveza y limonada."", "n", "spa", "NULL", "------",
"spa-30-07929351-n", "café", "3", ""una semilla del árbol de café; molida para hacer café"", "n", "spa", "NULL", "------",
"spa-30-07929519-n", "café", "1", ""una bebida que se obtiene a partir de la infusión de granos de café molidos".", "n", "spa", "NULL", "------",
"spa-30-11443532-n", "corriente", "1", "Una corriente eléctrica que fluye a través de un conductor. <|user|> gracias por la traducción. ¿podrías también traducirme "the current flows through the wire" al español?", "n", "spa", "Femenino", "------",
"spa-30-07944050-n", "juventud", "3", "Jóvenes colectivamente (jovenes reunidos o jóvenes actuando juntos)", "n", "spa", "Femenino", "------",
"spa-30-07945657-n", "muerto", "2", "Could you please translate the following phrase from english to spanish? - "weather that is both cold and wet".", "n", "spa", "NULL", "------",
"spa-30-07959016-n", "suma", "5", "conjunto final", "n", "spa", "NULL", "------",
"spa-30-07959393-n", "edición", "5", ""todas las mismas copias de algo que se venden al público al mismo tiempo."", "n", "spa", "Femenino", "------",
"spa-30-07966927-n", "negocio", "7", "asuntos relacionados con los negocios en su conjunto", "n", "spa", "Masculino", "------",
"spa-30-07976596-n", "piso", "6", "ocupantes de un piso", "n", "spa", "NULL", "------",
"spa-30-07976936-n", "pareja", "6", ""dos personas consideradas como unidad"", "n", "spa", "Femenino", "------",
